,txt
0,"저는 서울 중앙 검사 사무실입니다.검찰 사무실.Lee Chang Bay를 아십니까?어디를 돌아 보 셨나요?내 지식 중 하나가 있다고 생각합니다.당신은 나에게 무엇을하고 있습니까?이제 몇 살이신가요?'제발 줘.그때 나는 39 세의 사람이었다.나는 39 세의 사람이었다.ID 카드를 압수했습니다.Sinhan Bank도 발견되었습니다.나는 지폐를 요구하지는 않지만 우리는 우리가 압수 한 캐논 은행 계좌에 대해 이야기합니다.당신은 공개 계정이 아닙니다.나는 Sinhan Bank에 가본 적이 없습니다.사람의 이름을 훔치고 은행 계좌를 불법적으로 개설 한 은행 계좌는 포병 은행 계좌입니다.피해자가 다시 한 번 은행 계좌로 인해 발생하는 경우입니다.그는 또한이 장을 팔았던 사람이 있다고 말했지만, 그가 은행 책을 팔았거나 자신이 도난당한 지 여부를 나에게 연락했다.희생자, 피해자를 테스트해야합니다.나는 단지 공식 문서로 가서 우리에게 와서 설문 조사를받습니다.그런 다음 조사 될 것입니다.조사해야합니다.후원 녹음을 진행할 수 있으므로 원하는지 물어보십시오.그래서 지금 조사합니까?"
1,"이봐, 난 킴 다에게 맞았 어예, 당신은 잘하고 있습니다.나는 그것을했다.예, 김명의 남동쪽을 알고 있습니까?전혀 아무것도 없으며 그것은 당신의 것이 아닙니다.ID 카드의 경우 대량이 많았습니다.이것은 사이트에 중점을 둔 ID 카드에 중점을 두었습니다.김 12 개월에 그는 은행 책이 4 개의 이름으로 열렸다는 것을 확인했다.확인되었습니다.그렇습니다. 우리는 우리 측면에서 많은 사람들을 끌어 들이기 때문에 한 사람을 한 번 소환 할 수는 없지만 농업 조사의 형태입니다.당신은 당신입니다.옳지 만, 당신은 당신의 이름에 대한 대안으로 판단됩니다.예, 그렇게 보입니다.첫째, Kimmi는 사건의 경우 은행 계좌가 발견 되었기 때문에 피해자라고 말했다.또한 피해자의 단순한 피해자를 받아야합니다.세 번째 음성을 기록하거나 기록 할 때 법적 증거를 얻는 것은 어렵습니다.사진을 그대로 알려주세요.하지만 사건을 말 해주세요."
2,"예, 잘합니다.나는 교사의 사과에서 당신에게 연락했습니다.나는 정원의 길이라고합니다.공무원에서 나는 강남 구의 용매에 매료되었고, 나는 키친 리재 영라는 40 명의 여성들을 광고하고 Seongnam의 자녀의 재정적 위반을 위반했다.나는 Gaepo Bank 앞에 있었고 우리를 증명 했으므로 내 이름이 내 이름과 ID 카드 사본으로 발견 되었기 때문에 우리에게 연락했습니다.이 사건의 피해자, 당신은 당신의 개인과 여성에게 연락했습니다.지갑이나 신분증을 잃어버린 적이 있습니까? 개인 정보를 잃어 버렸습니다.이것은 9,470 만 승리의 결과가 아닙니다.이것은 소량이 아닙니다.글쎄, 이제 나는 피해자 나 피해자가 아니기 때문에 피해자가 아니기 때문에, 당신이 사건의 피해자라고 생각한다면, 당신은 그것을 증명해야하지만, 당신은 할 수 있습니다. 그룹에서 자신을 제외하십시오. 소송.이 경우 헤드와 대화 나 텍스트에 대한 기록이 없었기 때문에 처음 이벤트에 연락했습니다.이전에 땅을 알아 차리고 싶다면 큰 젖소와 녹지에 세 명의 파티가있는 경우 합법적 인 조명과 데이터를 확인하지 못할 수 있습니다.나는 지금 회사에 있습니다.'회사의 M이고 전화로 괜찮습니다.나는 나와서 이야기합니다.나는 잠시 동안 시작할 것이다.사실, 당신은 이것을 모릅니다.나는 그렇게한다.단기를 지불하십시오.괜찮아.이름 만 사실입니다.솔직히 말하면 개인 정보 보호법에 따라 계정 번호 또는 비밀번호 주민 번호를 표시해서는 안됩니다.은행 상속인은 단순히 지출입니다.맞어 그거야.날과 나의 무한실.불가능하지 않습니까?포도델이 있습니다.휴식이 있으며 하나는 예금 및 철수로 사용될 수 있습니다.당신은 그것을 사용하고 있습니다.내가 사용할 게.우선, 추가가 추가 된 경우 약 10 만 원의 10,000 원과 천만 ​​원으로 1 천만을이기십시오.나는 빵이있다.이것이 관련된 경우 일반적인 계정에 액세스하고 수술을 진행하십시오.나는쪽에 등록하겠습니다."
3,"MG Saemaur Undong.고객에게는 차이가 없습니다.신용에 특별한 문제가 없다면 최대 1 억 명을 얻을 수 있으므로 가이드가 있습니다.나는 jiu -jitsu daai에 간다.'M은 몇 년 동안 당신에게 요청해 왔습니다.통제 80이 많습니다.나는 생생한 생일입니다.통신 회사는 어디에서하고 있습니까?SK Yo SK의 독특한 이름이 맞습니다.이것이 당신의 이름입니까?당신은 지금 당신에게 많은 돈을 주어야합니다. 신용 등급이 더 많으면 많은 돈을 얻을 수 있습니다.정보에 참여하려고하지는 않지만 고객은 잘못되지 않습니다.예, 그것은입니다.오실 래요?인증 번호에 오지 않겠습니까?한 번 만나요.서울에는 대도시가 있습니다.1 월 2 일 1 월 2 일과 1 월 11 일에 언급 한 내용을 1 월 2 일에 언급 한 이유."
4,"이봐, 무슨 일이 일어날 지 볼 건가요?어디에 있나요?나는 이제 -GU를 이길 것이다.당신이 나를 아는 사람이라는 것을 알고 있습니까?당신의 화해는 무엇입니까?Kang Sang -sul의 사이트에서 은행 계좌 및 ID 수표 카드를 찾았습니다.2020 년 6 월 9 일 NACF 및 Shinhan Bank Brokerage 지점에 출판되었습니다.그리고 Sinhan Bank Jung -Gay -Don 브런치.피해를 확인하기 위해 개방되었으며 피해자는 범죄에 사용되었습니다.이 발견은 가해자로 간주되지 않으므로 피해자는 아직 희생자가 아닙니다.나는 검찰과 판사에게 순종 할 것이다.당신은 지금하고있는 일을합니다."
5,"아니요, 노트북 Katok 사기 사건에 대한 몇 가지 수표에 문의했습니다.예.불만을 접수했지만 이름이 지명되고 피해자가 있으면 불만 사항이 자동으로 취소됩니다.피해자가 많지만 확인해야 할 다른 부분이 있으며 한동안 보호되었습니다.그것은 복지 ID 카드와 Nongyup Bank Cannon 계정에 의해 제품의 이름으로 압수되었습니다.왜 대답하지 않았습니까?뭐라고 하셨나요?미안하지만 질문을 할 수 없습니다.은행 계좌는 2020 년 9 월 17 일에 2020 년 9 월 17 일에 Yeongdeungpo -Gu -Logs 건물에 새로 개설되었습니다.Nongyup의 Nongyup Bankbook.당신은 그것을 열어 본 적이 있습니까?작년 2 년 동안 Idiphuan.그것은 열린 것 같습니다.저게 뭐에요.나는 은행 계좌를 대체물로 만들었다는 진술을했다.또한 은행 계좌를 돈으로 구매하고 은행 계좌를 구입했습니다.나는 은행 책을 샀다.그것은 동일했지만 Kangmia는 John Bam-Mi에게 많은 돈을주고 은행 계좌를 구입했습니다.이제 나는 당신에게 돈을주고 은행 계좌를 샀습니다.너.왜 구매할 건가요?나는 당신을 살 것입니다.소환장을 보내 드리겠습니다.드래그하지 마십시오"
6,"당신이 우리 은행에있는 우리 은행에 대한 간략한 설명이라면, 당신은 당신이 사용하는 고이자 부채를 기꺼이 할 의향이 있습니다.괜찮아.예, 정부를 검색하십시오. 신용 대출을지지합니다.10 명의 전문가가 사용합니다.예, 저는 금융 회사의 10 %를 사용합니다.현재 비즈니스 소유자 또는 직원입니까?귀하는 직원 또는 사업자입니다.비즈니스 소유자, 몇 년 동안 사업을 해왔습니다.나는 10 억이 있습니다.그렇습니다. 약 3 억 개의 필요가 필요할 것으로 예상됩니다.결석.나는 그것을하고있다.당신은 그것을하고 있습니다.내가 지금 사용하고있는이 휴대 전화 번호는 내가 말한 번호입니다.나는 당신을 안내하지 않습니다.그리고 오늘 나는 오늘이 대출을 먼저 부르고 있습니다.일단 전화하면 65 년 안에 태어날 것입니다.내 앞에있는 휴대폰 번호의 수를 알려 드리겠습니다.코로나, 그래서 나는 모두 내가 소녀에게서 도망 쳤기 때문에 많은 스트레스를 느낍니다.예, 저는 보험 회사에 가서 보험 회사를 얻었습니다."
7,"당신은 어디에서 이상한 말을 했습니까?지불 수수료 나 휴대 전화 요금을 지불 할 때 이것이 정상에서 벗어난 것으로 확인되었습니다.전화로 갈 때 구입 한 적이 없습니다.。예, 예, 예, Gannam 경찰서의 사이버 설문 조사 팀인 Kim Jinkyung.또한 472,000 원으로 로봇 청소를 구입했습니다.나는 고용되고 싶다.그러나 사용하는 스마트 폰은 조용합니다.예, 모델을 알고 있습니까?언제 저에게 연락 했습니까?당신이 할 수 없다면, 당신은 그것을 누를 수 없습니다.당신의 개방성을 확인한 적이 있습니까?글쎄, 나는 모른다.나는 그런 것들을 많이 본다.나는 그것을 바로 먹을 수없고 그것을 먹을 수 없다.알아야하지만 그러한 텍스트를 열면 휴대 전화에서 취소됩니다.당신은 당신이 가진 것이 있습니다.그와 같은 일은 없다.ID 카드와 라이센스 가이 결제 문이 유출되고 있음을 훔치고 있습니다.이를 위해, 우리는 UBI 급여에서 피해자의 단위 신청서를 보내고 피해자의 단위 신청서를 UBI Pay로 보냅니다.Kookminbank 계정이 확인되었음을 확인했습니다.왜 당신은 항상 돈 앱에서 나온 것입니다.그래서.당신이 물어보고 싶은지 묻습니다.우선, 보호법을 보호 할 때 개인 정보를 말하지 마십시오.당신이 말하면, 나는 남자입니다.계정의 자산이므로 상식을 만들 수 있습니다.직접 전화 할 수없고 전화 번호로 전화 할 수 없습니다.전화를 걸고 전화하겠습니다.예, 내가 그렇게한다는 걸 알아요.네 감사합니다.어떻게 하시나요?그녀는 지금 사기꾼입니다. 그녀를 잡을 수있는 방법이 있습니까?"
9,"안녕하세요, 당신은 여기서 좋은 일입니다.이것은 소울 센트럴 브런치입니다.비슷합니다.전화를 걸 수 있다면 사건의 내용을 전달하고 주문을 제공합니다.나는 당신을 몰랐고 내 이름을 바꿨습니다.그리고 지난 2 년 동안 정보 및 ID 카드 휴대폰에 대한 지갑이 발표되었습니다.그러나 당신의 빵 덕분에 나는 모든 것을 안에 넣었습니다.최근에는 유행입니다.나는 그렇게하지 않습니다.나는 그것을 세 셋에 매달고있다.다이어리.이 과정 에서이 과정은 많은 증거의 증거를 압수했습니다.2018. 나는 나에게 주어졌고, 나는 Yeongdeungpo에 은행 책을 열지 않았다고 말했다.Kim Te Hiwan이라는 파티 인 Kim Te Hiwan은 두 개의 은행 계좌를 개설하고 2 개의 은행 계좌를 대포 계좌로 사용했습니다.이 은행 책을 듣습니다.받아쓰기.십대 또는 두 번째 번개 시장입니다.나는 여기에 은행 계좌에 돈을 남긴 사람들에게 속했다.예, 아닙니다.예금이나 예금은 막 끝났지 만 돈은 돈에서 벗어 났거나 그런 것이 없었습니다.나는 그것을 전혀 찾을 수 없었다.당신이 지위라도 금융 부문이 발생하기 때문에 그렇지 않습니다.그는 2018 년 12 월 20 일이라고 말했다.나는 내가 몰랐던 계정을 몰랐다.조금 이상하지만 조금 이상하지만, 비 제프에서는 사용하지 않았기 때문에 왜 그것을 사용했는지, 그 당시에는 다른 금융 농업 협동 조합을 떠났지만 계정을 취소했습니다.나는 갈 것이지만 나는 그것을 사지 않았지만 나는 불행합니다.나는 지금 내 친구를 만나러 가야한다.입력하십시오.그래서 저는 100 억입니다.증거 절차는 필연적으로 금융법에 따라 처벌을 처벌하기 때문에 불가피합니다.네, 맞습니다.예,이 전화 번호가 정확합니다.이것은 이름입니다.아버지는하지만 오프닝은 내 이름입니다.그게 다야.그것이 바로 아버지가하는 일이며 아버지는 너무 많은 데이터를 사용합니다.그러나 아버지만이 저를 지불하고 내 이름입니다.이 녹음 설문 조사를 말해야합니까?우리에게 그것을 돌려주고 싶습니까?"
10,"예, 당신은 당신을 볼 수 있습니다.그렇습니다. 당신은 서울 중앙 검찰 리현 주의 좋은 일입니다.이것은 이것을 아는 사람입니다.이제 우리는 Kim의 사기 사기입니다.은행 계좌 정보.예, 은행 계좌를 찾았습니다.그렇습니다. Nonghyup Bank와 Shinhan Bank Bank Bank가 발견되었습니다.Sinhan은 Urbae의 달에 발행되었음을 확인했습니다.피해자가 익숙해 졌을 때입니다.나는 당신에게 연락했습니다.적의 의심의 여지가 없기 때문에 아이의 머리가 피해자로 입증 될 수 있기 때문에 적절한 혈액에 따라 그것을 증명하는 것은 여전히 ​​불가능합니다.소환 형식으로 녹음하여 진행할 수 있습니다.실제 녹음에 동의하십니까?정보법에 따라 연구 기관에는 사회 보장 번호 또는 계정 번호 비밀번호가 필요하지 않습니다.당신은 큰 소리로 말할 수 있습니다.예, 큰 소리로 말할 것입니다.이 녹에 사로 잡힌 이름과 나이.그것은 당신의 머리 속에 있습니다.똥이야.당신은 흰색으로 무엇을 말하고 있습니까, 지금 관절을 제거합니까?뭐하세요?세계"
11,"당신은 여기 있습니까?문제는 무엇입니까?나는 지금 Nongyup Bank의 미래에 있습니다. 무슨 일이 일어나고 있습니까?나는 그것을 만들지 않았지만 나는 그것을 말할 수 없었다.당신은 무엇을 하시겠습니까?그것은 또한 최고의 검찰청이라고도합니다.즉시 수정하지 마십시오.나는 그것을 다시 먹을 것입니다.다시 먹어주세요.예, 실업자입니다.예, 나는 당신의 아버지가 아닙니다.이것은 내 아버지의 범인입니다.나는 지금 범인을 키우고있다.왜 당신의 아버지의 양육권?"
13,"서울 대도시 경찰 기관의 사이버 설문 조사 팀입니다.지난 주에 내가 찾는 이유는 우리가 서울 매트의 금융 회사이기 때문입니다.추위이고 당신은 관심이 있습니다.예, 우리는이 압력에서 발견되었습니다.발견되었습니다.은행 계좌입니다.대포 계정입니다.저의 은행 계좌, 저는 은행 계좌, Nongyup National Council, Hana Bank입니다.나는 그렇게한다.나는 앞서 언급했다.교사의 거주 등록 카드가 있습니다.그는 당신을 인도 할 것입니다.아니, 지금 주문하고 있어요., 파견 주문 또는 소환이므로 전화로 보내야합니다.현지 경찰관입니다.사이버 설문 조사 팀입니다.오, 나는 수사관을 담당하고 있습니다.나는 경사입니다.무엇에 관심 있습니까?귀하의 전화 번호는 여러 전화 번호입니다.얼마나 많은 사람들이 있는지 확인해야합니다."
14,"예.예.네, 맞아요.예,하지만 왜 나를 그렇게 느리게 만들까요? 지금 어디서하고 있습니까?어디서 말했어?검찰의 사무실입니다.그것은 중요하지 않습니다. 중요하지 않으며, 나는 그것을 저에게 보내겠습니다."
15,"Hello Pepper Saving Bank 이것은 Pepper Savings Bank입니다.당신은 이제 높은 이자율을 가지고 있습니다.예, 당신은 당신이 지금하고있는 일을하고있는 사업가 인 직원입니다.단기 연체 기록은 없습니다.m을받습니다.Phil Dae -Hwan이 승무원에게 추가 되었기 때문에 조금 필요합니다.예, 좋은 고객을 확인하십시오.최근에 귀하의 문의에 대해 알아 보려고 노력하고 있습니다.정확한 부채 기록을 읽으십시오.교체 목적보다 더 많은 자금이 있습니다.고객 서비스 대행사는 어디에 있습니까?예 Uplus는 LG의 저렴한 전화 통화가 아닙니다.팀 리더.저는 팀 리더입니다.당신은 팀의 수장입니다.CEO와 Karma를 구별 할 때, 나는 담당자의 이름을 구별합니다.나는 당신이 그것을 알고 있지만 당신의 전화 번호의 이름을 알고 있습니다.예를 들어, 여기에 한 곳이 있는지 여부는 중요하지 않지만 여러 곳이 있습니다.집이 있다면 집은 이제 헌장입니다.우선 순위가 있다면 기본적으로 약간의 질문을하십시오.나는 그것을 시도하지 않았다.나는 당신에게 말했다.나는 지난번에하지 않았다.1985 년 2 월 1 일, 2 월 1 일입니다.7 자리는 어떻게 있습니까?예, 우리는 당신을 보내고 있습니다.정확한 생일입니다.후추 저축 은행입니다.국수에 7 석이 있습니까?1985 년 2 월 1 일입니까?"
16,"안녕하세요, 그렇습니다. 그게 Hana의 금리입니다.Kim Jongman이 옳습니다.추가 돈이 필요합니다.지금은 많은 돈이 필요합니다.추가 자금이 필요합니다.나는 그것이 직업이 될 것이라고 생각합니다.사무실 직원.4,000 이었지만 지금은 있습니다.네 지금 요.예, 저는 18 살입니다.자본 저축 은행에 사용됩니다.캐시 서비스를 사용하십시오.카드가 없습니다.그런 다음 수표가 있습니다.예, 안녕하세요, Lee John -Customer.예, 나는 Hana 재무 책임자에게 배정되어 연락을 받았습니다.5 월 6 일 휴대 전화 캐리어는 무엇입니까?그것을 사용하는 것이 아닙니다.나는 그것을 사용하지 않습니다.나는 그것을 사용하지 않거나 재활 파산이나 연체가 있습니다.그 사람은 무엇입니까?직장의 이름은 무엇입니까?그는 주택 형식의 ​​형식은 아파트이며 소유권은 자체적으로 평가되었다고 말했다.자산이있는 경우 더 많은 금리와 제한을 계산할 수 있습니다.당신은 조금 정확할 수 있습니다.예, 괜찮습니다.나는 당신이 지금 4000이 필요하다고 말했습니다.그런 다음 약 4 천만이 필요합니다.네 네 네 네.이자율은 10.6 %입니다.팩스를 보내주세요.문자 나 전화를 보내주세요."
17,"꿀.따라서 몇 가지 필요가 있다면 잠시 동안 필요합니다.그 시점에서 그것은 약 5000입니다.예, 한동안 말할 수 있습니다.어쨌든 우리는 대출을해야하기 때문에 문서를 작성해야합니다.그래서 지금 나는 당신에게 미리 묻습니다.나는 지금 처음입니다, 그것은 당신의 첫 번째입니다. 그것은 나를 자동차 번호라고 부르는 첫 번째입니다.그게 다야, 대출을받는 것은 쉽지 않습니다.말하고 싶지 않다면 지금 당장 말할 필요가 없습니다.예, 예, 예, 월 소득이있는 시간을 말해 주어야합니까?350입니까?당신은 18 년 동안 일해 왔습니다.은행 계좌로 급여를 받습니까?이전이 아닙니다.나는 그것을 조금하지 않는다.죄송합니다.잠시 죄송합니다.이것은 지금 고객과 상담 할 때입니다.당신이 지금 차를 물을 때 기분이 좋지 않으면 죄송합니다.나는 그것이 처음인지 모르겠다.나는 가이드를 줄 것이다.그것은 큰 문제가 아닙니다.지금 당장 건강 보험료를 주지만 세 개만 원합니다.내가 당신을 안내하겠습니다, 당신은 그것을 보낼 수 있습니까?고객에게 전화를 보내주십시오."
18,"안녕하세요 SBI 저축 은행.계획중인 경우 문의에 의해 감소 ​​할 최소 이자율을 계획하는 경우 먼저 조건을 들어보십시오.이것은 지금이며, 급여는 어느 정도까지 설정됩니다.3800입니다.직원의 우선 순위는 계산할 수 없습니다.내가 연락을 드릴 것입니다.SBI 저축 은행은 어디에서 말했습니까?이겼다.네, 맞습니다.자금에는 얼마가 필요합니까?얼마나 필요합니까?얼마입니까?현재 2000 년경이라면 급여에 비해 100 %를 넘지 않습니다.나는 그렇게 할 수 있다고 생각하지만 약 2 천만 원이 필요했고 현재 신용 카드를 사용하고있었습니다.무급은 없습니다.나는 당신이 더 나올 것이라고 생각합니다.간단한 소득 사료.나는 그것을 문자 메시지로 남겨 둡니다.언제 뻣뻣 할 수 있습니까?시간을 주어야 할 때.나는 당신을 떠날 것입니다."
19,"안녕하세요, 저는 Kim Jo -Hyun, Kim Ji -Hyun 부국장 및 John의 상담을 도왔습니다.나는 아직도 그렇게하고있다.프로모션 기간이기 때문에 나는 당신과 연락을 취하고 있습니다.축적.생년월일은 어떻습니까?예, 2 월 27 일과 1985 년.예, 휴대폰의 이름은 2 월 27 일과 1985 년 2 월 27 일과 1985 년입니다.이전 전쟁은 시간이 아니며 지금 확인할 수 없습니다.나는 중소 규모의 비즈니스 대출이나 사업주가 많지 않지만 비즈니스는 아닙니다.나는 지금 사업을 시작하고 있습니다.예, 일하러갑니다.회사입니다.그것은 제조 산업입니다.그것은 제조 산업이었고 당신이 일한 기간이었습니다.18 년.월 평균 월급은 특정 달을 취득했습니다.적은 없습니다.나는 카드를 사용합니다.신용 카드를 사용하지 않았습니다.나는 그렇게하지 않았다고 말했다.이 모델은 이제 Avanteno 이후 몇 년이 지났으므로 카드가 없으므로 카드 대출 현금 서비스가 없습니다.그 후, 나는 연기되지 않았다.제한과 금리를 계산하자마자 연락 드리겠습니다.현재 한도는 최대 4500입니다.이자율은 약 8.9 %입니다.당신은 갈 것이라고 말했습니다.그런 다음 신분증 사진과 신분증을 교과서로 넣을 수 있습니다.예, 당신은 일할 것입니다.건강 보험 회사에 전화하면 쉽게 보낼 수 있으므로 문서 양식을 보내드립니다."
21,"안녕하세요, 당신은 고객 비고이 업 금융입니다.당신은 그것을 살 수 있습니다.예, 당신의 월급은 얼마입니까?고객 연도 SAL은 4000입니다.4000은 4000입니다.대출이 있습니까?대출 대출 대출.대출이 없습니다.아니요, 그렇습니다.지금 얼마나 필요합니까?얼마나 걸립니까?문제가없고, 연체가 없거나, 그런 것이 없습니다.그것을 사용하십시오.오랜만이야.예, 당신은 13 년 동안 일해 왔습니다.예, 예, 잠시 동안.나는 소녀에게 왔지만 현재 대출은 없습니다.예, 당신은 당신의 신용에 문제가있을 수 있습니다.개인 재활 및 신용 회복과 같은 것이 있습니다.현재의.대출 외에는 아무것도 없습니다.신용에는 아무런 문제가 없습니다.예, 신용 카드를 사용합니다.신용 카드가 없습니다.최대 한도를 살펴보면 한도는 3200이며 다음 부분이 결합되며 기간이 계획됩니다.이 작업을 수행하고 있다면 회사 또는 개인입니다.회사와 회사입니다.한도를 먼저 알 수 있습니까?나는 지금 결혼했다.넌 결혼하지 않았다.내가 결혼하고 있지 않다.내가 결혼하고 있지 않다.가족이 있다면 더 유리합니다.가족.왜 그런가요?이것을 물어 보는 것이 잘못된 이유는 무엇입니까?아니, 난 그냥 나에게 묻는다.그래서 저는 금융 이력 심사 부서에서 결혼하거나 미혼입니다.진행되지 않습니다."
