,txt
92,"전화 해요.나는 신용 대출을받을 것입니다.예를 들어, 나는이 돈을 씁니다.나는 그것을했다.나는 그것이 남자인지 여자인지 확인했다.당신이 듣고 있는지 알고 있습니까?그리고 2 천만 명의 이길 수 있다면 2 천만 원을받을 수 있다면 전화하지 않을 것입니다.어린 시절 통화 일에 사용하도록 요청하면 원하는 경우 사용 하시겠습니까?임대료를 임대하려는 경우 돈이 충분하지 않아서 할 수 있습니다.제발 전화주세요.분위기에서 기다리고 대출을 받고 있다면 오늘 알려주십시오.당신은 좋은 요청이 있기 때문에 멀리 떨어져 있습니다. 15882114 전화로 전화하십시오.전화를 걸어 전화를 누르십시오.당황하고 유연하게 만들지 않으면 실수로 알아 차릴 수 있습니다.당신이 좋다면 피자가 피자를 도와 주나요?전화를 끊으면 내 전화에 응답하지 마십시오.전화 할게.그런 다음 내 전화에 응답하지 마십시오.전화가 끝날 때까지 알고 있습니까?"
93,"잠시 좌석에 가서 지금 전화 할 수 있습니다.숨겨서는 안됩니다.파티는 1991 년 7 월 21 일에 태어날 것입니다.이 세대의 김 미닝 시크 (Kim Myung Chic)에 대해 모르십니까?나는 당신을 만난 적이 없지만 들어 본 적이 없습니다.예, 2016 년 11 월 23 일.은행 계좌와 Nongyup Bank Bank를 열었습니까?잊어 버려.나는 체포되었다.즉시 손 번호에 연결합니다."
94,"안녕, 내가 해냈어.그것이 진행됨에 따라, 그것은 순차적으로 진행됨에 따라 조금 느리게 할 수있는 부분입니다.결석.당신이 1 시까 지 일할 때, 당신은 혼자입니다.당신은 혼자.당신은 그것을 혼자 찾을 수 있습니다.그런 다음 집 근처에 있습니다.나는 내 근처에있다.집.내 이름을 요약하겠습니다.그런 다음 집에 갈 때 사무실의 사무실과 대화해야합니다.그런 다음 3 분 안에 다시 연락하십시오."
95,"예, 당신은 이제 도착했습니다.당신은 여기 있습니다.지금 어디서 나왔어?은행에서 나온 은행.아니요, 당신은 당신이 비 지시 은행의 대형 EG 은행에 노출되었다고 들었을 것입니다.나는 이전에 금융에 대해 설명했지만, 내가 큰 예를 들어, 내가 겨울을 옮겨야 할 펀드는 이적 권리입니다.당신은 당신에게 그것을 데리러 오라고 말하지 않았다. 나는 당신에게 가라고 말하지 않았다.나는 그것을하지 않습니다. 이것은 Nongyup Bank에서 직접 돈을받는 것을 의미합니다.어쨌든 당신이 가지고 있는지는 중요하지 않습니다.나는 지금 그것을하고 싶지 않다.나는 당신과 협력하려고하지 않습니다.난 그냥 이야기하고 있어요.너.당신이 돈을 선택하고 그것을 할 수 없다면, 당신이 원하는 것을하고 싶다면 직접 가서 조사하십시오.저에게 전화해서 전화하십시오.제발 그렇게하십시오.Kim Sok Jay가 확인되면 그는 자신을 듣습니다."
96,"예, 모든 것을 읽은 적이 있습니까? 질문이 없습니다.나는 아프다.은행으로서 많은 문제가 있으며, 작년에 2013 년 NACF를 만든 사례를 알고 있습니다.많은 사람들이 개별 정부에서 유출되었으며 오늘날까지는 피해 왔지만 이제는 피해자와 가해자 모두 수사관의 상환을 조사하고 있습니다.계정 절차에 캡처 된 금융 부문은 거래의 세부 사항 또는 자금 흐름으로 식별됩니다.우리는 지난주에 불법 이름을 기반으로합니다. 우리는 정확한 증거를 채택하기 위해 자금을 거래하고 있다는 것을 알고 있습니다.그들은 소방 직원이 없기 때문에 Yebong Bank 직원에 대한 진술을 할 때 은행에 갈 때 은행과 카드와 카드를 방문합니다.당신이 그것을 보면, 당신은 모두 은행 부서에 등록되어 있습니다. 개인 정보의 경우, 은행 계좌의 흑인 자산은 은행 직원에게 제공되며 은행 계좌 만 그에게 반환됩니다.이것은 육안으로 볼 수없는 가장 중요한 개인 정보입니다.그렇습니다. 일반 대중은 육안으로 확인할 수 없지만 전문가들은 컴퓨터 상을 수상 할 것인지 즉시 확인할 수 있습니다.코드 번호.자기 이름이라면 내 이름입니다.한국의 금융 부문 유형에 관계 없이이 자기는 모두와 일치합니다.은행 직원에 따르면, 나는 상주 등록 카드의 사본 또는 자기를 불법적으로 사용했습니다.은행 책을 열면서 외부에서 불법 조정을하고 금액을 받았으며 은행 계좌를 판매했습니다.은행의 많은 문제로 인해이 은행 직원은 은행 직원에 속합니다.재무 이사의 원칙적으로, 우리는 내부 음모를 수행하기 위해 설문 조사를 실시하고 있습니다.당신이 불법이라면,이 불법 사람들은 개인 정보를 사용하고 이제 위장을 가지고 있으며 ARS 와이어를 요청할 수 있습니다. 당신은 당신입니까?결론을 피하고 싶지 않다면 신용 카드의 경우 신용 카드를 사용하고 있습니다.우선,이 카드 대출과 상담해야합니다.상담을 받아야합니다.현재, 당신은 원보다 더 많이 빌려줄 수 있으므로 대출을받을 때 대출을 받아야합니다.나중에 피하면 카드와 대화 할 때 상담 직원과 상담 직원의 예가이 사람이 그 이름을 밝힐 지 여부에 관계없이 좋습니다.확인해야합니다.기록을 녹음하고 싶습니다.Jamsil의 카드 회사 직원과 전화를해야합니까?나는 그것을 볼 필요가 없다.질문을 살 수 있습니다.귀하의 이름에 대해 이야기하지 않으면이 사람의 내부 설문 조사를 확인하여 수행하십시오.나는 당신이 말하고 있다는 것을 압니다.더 많은 카드를 사용하지만 다른 카드를 사용하십시오.당신은 거기에있을거야.예, 당신은 당신에게 전화를 걸어 대출을 받아야합니다.나는 카드 대출을 받고 싶다.당신이 이것보다 더 많은 경우, 당신은이 카드 대출을 받고 계정을 입금 할 수 있습니다.이자 나 금리에 대해 걱정할 필요가 없습니다.분명하다면 이것을 처리 할 수 ​​있습니다.기존 양식의 일부.당신이 가진 최대 한도가 5 백만 개 이상인 경우 저희에게 연락하십시오.최대 한도가있는 경우 최대 제한이있는 경우 최대 한도가있는 경우 저희에게 연락하십시오.2000 년에 최대 1 천만 명의 승리를 받게됩니다.유도 질문이 있습니다.대출을 사용하려면 남자에게 돈을 쓰고 싶다면 사업과 대화하고 전화를 걸어 한 번 확인하겠습니다.최대 한도로 대출을 은행 책에 넣으십시오.저게 뭐에요?。나는 현대 섬에 Uri Bank와 Busan Bank에 그것을 넣었습니다.계속하겠습니다. 그러나 이제 회사에 전화하여 상담하겠습니다.10 분 후에 다시 연락 드리겠습니다.당신은 그것을받을 수 있습니다.은행 계좌.예, 그렇습니다"
97,"예, 예, 예 예 예 예 예 예 예 예, 예, 예, 지금 봅니다.하지만 그냥 줘.나는 그것을 얻지 못했다.5시에 그것을하기 위해.기간 전에 연락을 취하지 않았거나 경찰관이 그것을 찾을 수 없다면, 나는 당신에게 별도로 당신에게 알렸다.오늘, 오늘, 당신은 우리 자신의 것을 조금 조사해야합니다.나는 여자가 있고, 당신은 여자이고, 당신은 방에서 일하고 있습니다.이 데이터를 사용할 때 명심해야 할 사항이 있습니다.그리고 Wi -fi.만나면 저녁에 알려 드리겠습니다.친구를 만나는 곳마다 별도로 연락 할 수 있습니다. 그렇지 않으면 이렇게 열 수 있습니다.나는 조치를 취하고, 조치를 취할 것입니다. 그래서 나는 하루 동안 휴대 전화를 끝내고, 데이터에서 벗어나 Wi -fi에서 휴대 전화를 5:00에서 6:00으로 멈 춥니 다.집에 갈 수 있습니다.'루트 최저치 Wi -fi 및 데이터는 사용되지 않습니다.주문할 때까지, 당신은 당신의 직업을 알고 있습니다.은행에는 또 다른 계좌가 있었지만 그것을 아는 많은 사람들도있었습니다.그들은 얼마나 알고 있었습니까?나는 약간 긴장합니다.그것에 대해 걱정하지 마십시오.아버지는 이제 죽었습니다.한동안 일시적인 장애물.예, 그들은 그들을 만질 수 없습니다.당신은 그 전에 일하기 전에 일하러 갈 것입니다., 우리는 우리에게주지 않습니다.예, 지금 찾으려고 노력하고 있습니다.그들은 제외했지만 휴대 전화를 떠났으므로 선생님을 얻을 수 없다면 어떻게해야합니까?그렇기 때문에 모든 안전 조치가 있습니다.우리가 걱정하지 않더라도 걱정하지 않을 것입니다.우리는 기간 동안 계속 데이터를 제공합니다.당신은 그것에 대해 걱정할 필요가 없습니다.당신은 그것을 가지고 있지 않습니다.당신은 당신을 도와야합니다.예, 알다시피."
98,"금융 범죄 수사 팀인 Kim de Young은 Jaon Sannam Masan의 42 세의 김하 -사무국 장관입니다.동의없이 얼어 붙었습니다.얼어 붙은 것이 무엇을 의미하는지 아십니까?이것은 두 개의 압수 된 계정에서 알지 못하는 추가 계정을 찾을 수있는 상황입니다.재무 정보를 요구하지 마십시오.당신은 알고 있어야합니다.장점으로 대답 해주세요.내 은행 계좌를 만든 모든 은행에 알려 드리고자합니다.그러나 예금과 서랍 수수료는 한동안 다른 것입니다.또한 퇴적물과 서랍의 양입니다.둘 다입니다.입금 및 인출.은행 계좌에는 그러한 부분이 없습니다.저축은 없습니다.어머니는 내 이름으로 그것을 붙잡고있을 수 있습니다.나는 그것을 모른다.신청할 방법이 없습니다.예, 확인 해주세요.시간이 오래 걸릴 것이라고 생각합니다.얼마나 시간이 걸려요?지금 얼마나 걸립니까?나는 잠시 거기에 갈 것이다.당신은 긴장을 풀 수 있습니다.무슨 뜻이에요?무슨 뜻이에요?Nonghyup에가는 것은 무엇을 의미합니까?나는 그것이 오랜 시간이라고 생각합니다.예는 약 87,000 원입니다.예를 들어, 10 만 회 미만.200,000 원도 미만입니다.나는 이것을 내 이름으로 본다. 그래서 어머니는 그것을 개별적으로 내 이름으로 넣지 않습니다.나는 당신에게 연락하여 프로덕션을 다시 재현 할 것입니다.그렇지 않으면 지금 사건을 끝낼 수 있습니다."
99,"그는 그것을 해자로 보지 않습니다.우리는 개인 이름의 조용한 희생자이지만, 나는 피해자라는 증거가 없기 때문에 여전히 희생자를 돕기 위해 노력하고 있습니다.아직 그렇지 않은 것은 아니며, 대신 법원에 제출되었습니다.귀하는 증거를 기록 진술로 채택하지 않습니다.예, 예, SNS에 아무것도 공개 한 적이 없습니다.조금 더 전화가 필요하지만 오랫동안 조용한 곳으로 가서 성명서를 요청할 수 있습니다.당신은 당신의 것입니다, 당신은 어디 계세요?소울 검사의 승진 범죄 수사 팀인 Lee Ba ​​Gun 수사관.예, 당신은 혼자입니다.일부 메모.우선, 그것은 당신에게 중요하므로 조심하고 신중하게 대답하십시오.나는 이것을 결코 묻지 않을 것이지만, 나는 이것을 따르지 않을 것이다.네, 그렇게합니다.현재 38 -year -old male kim hi churu gwangmyeong -si, gwangmyeong -si, gwangmyeong -si.첫째, 두 계정 모두 동결에 사용되므로 추가 피해자가 얼지 않도록합니다.계정과의 잔액의 경우 소스가 결정되지 않습니다.우리 모두는 차의 손상을 인수하기 위해 조치를 취합니다.설문 조사는 설문 조사가 완료 될 때까지 끝납니다.필터링하는 경우 일반 청구서가있는 경우 은행 이름을 알려주십시오.한 달 이내에 거래가없는 경우, 최근 대포 계정 사례는 휴면 계정으로 등록되어야합니다.당신은 당신이 한 가지만 사용하고 있다고 말했지만, 당신이 열린이 계정은 정확합니다.예를 들어 계정에 계정이 있든, 예를 들어, 예를 들어 보증금 또는 인출 또는 입금 구독을 제외하고 CM을 그리는 경우 Kookmin Bank에 계정이 있습니다. 그렇지 않습니다.Kookmin Bank에는 계정이 없습니다.나는 대학생에게 갈 계획입니다.나는 즉시 학교에 갈 것이다.그 후 Nara Card와 Hana Bank는 학생 ID 카드로 사용 된 두 개의 계정 만 사용합니다.Kookminbank와 Hana는 은행이 현재 일반 계좌를 떠나고 있다고 말했으며 거의 ​​1 년 동안 Hana Bank를 확인하지 않았습니다.Kookminbank는 약 130,000으로 승리했습니다.대포 계정으로 사용될 수 있습니다.다시 연락하면 첨부하지 마십시오.글쎄요, 그렇습니다"
100,"그것이 그렇게하는 의식입니다.이 과정에서 회사의 이름 Hana Bank 계정이 발견되어 설문 조사 차량에 연락했습니다.Hana Bank는 전혀 없었습니다.당신은 그것을 열었습니까?Gwangmyeong -Si는 금융 부문을 보지 못했기 때문이 아닙니다.가해자이거나 개인 정보의 피해자가 아닌 경우 피해자 인 경우 연락을 취했습니다.대지.예금을 안내 한 후, 나는 조금 철수하고 탈출했다.하지만 죄송합니다.너무 많은 음성 낚시로 가져올 수 있습니다.그래서 나는 당신에게 일방적으로 말할 수 없었습니다.180 명 이상이었습니다.저희에게 연락하여 집으로 보내십시오."
101,"과일이 없기 때문에 녹음 기록을 진행할 것입니다.이것은 휴대 전화가 아닙니다.이런 이유로, 하만 공주의 공주가 가중치가 있거나 자음이나 목소리를 가지고 있다는 사실입니다. 필요합니다.따라서 저는 개인 정보 번호 또는 지폐에 대해 묻거나 묻지 않습니다.은행 부문.어떤 의미에서, 나는 사건의 경우에 매우 일반적이지만,이 충격적인 것은 울창한 콜존이 은행의 직업이라는 것입니다. 문서 이름은 이제 무술과 넥타이입니다. 사건의 직원 Gaza -John 비 -Gwan Mion의 8 세기 문서는 외부의 큰 사례이며 여전히 지휘자입니다., 나는 기록이없고, 지금은 연료이며, 피해자를 습득했으며, 조사 중입니다.나는 그것을 가지고 있지 않다.그렇지 않습니다.당신이 옳다면, 당신은 피해자의 피해자와 협력 할 수 있습니다.당신은 성전입니다.죄송합니다.나는 서울 중앙 프로모션 재무 검사와 샘 돈 신재의 회원이라고 말하고자한다.Hana Bank와 Uri Bank 계좌가 Gyeonggi -do의 Chorsan 지점에 게시되었다는 것을 알고 있었고, Cannon 계정 형태로 범죄를 사용했다는 것을 알고 있습니까?결과적으로, 나는 그것에 관계없이 추가 사상자를 얼렸다.당신은 당신이 가진 상태를 이해합니까?그렇습니다. 평범한 꿈 외에도 당신이 언급 한 평범한 꿈 외에도 불법적 인 설명이 발견되었습니다.간단한 진술을 해주세요.나는 그것을 사용했다.Dan 또는 Securities 또는 Stocks, 당신은 그것을 몰랐습니다.이 사건의 모든 가해자는 약 5 년 동안 비 지시 직원이기 때문에 법정입니다.예금 예금 예금 예금 예금.우리는 회사 덕분에 귀하의 개인 정보를 찾지 않습니다.설문 조사는 실시되었지만 설문 조사는 동일하지만 같은 것을 보낼 것입니다. 그러나 나는 재단이 될 것이지만 은행 계좌와 은행 계좌가 있습니다.약 10 분에서 20 분 동안 끝나지만이 설문 조사가 끝날 때까지 6 시간 동안 기다릴 것입니다. 그래서 우리는 4 분 동안 이야기 할 것이지만 당신은 교사입니다.300-400 명의 희생자는 300-400 명 이었지만 모든 물을 진행할 수는 없었습니다.그것은 당신이하고있는 일과 다르기 때문에 물론 우리는이 연례 고무가 될 것입니다.오, 모델을 보여 드리겠습니다.나는 지금 녹음하고 있었기 때문에 진행 중이었다.그리고 우리의 금융 감독자가 준비되었습니다.높음, 나는 은행 책이 있습니다.작고 철회되며 많은 대출이 있습니다.그게 내 방입니다.나는 지금 보호 된 금액에 대해 이야기하고 있지만 그것에 대해 이야기하고 있습니다.500,000 원과 600,000 원을 받으십시오.우리는 백만 명 이상의 우승자 사이의 차이를 줄 것입니다.계정 회사가 백만을 초과하면 계정은 불법으로 간주되며 손상은 귀하가 방지합니다.2 백만 원이 2 백만 원없이 나오면 나머지 자금은 불법으로 간주되며 우리는 압수됩니다.뭐하세요?설문 조사 결과가 귀하의 진술의 사실과 다르면, 위증이 확립됩니다.확인이 확인되면 손상 시스템이 도착합니다."
102,"당신이 맞습니다.네, 맞습니까?예, 연락 했습니까?Gyeonggi -Do의 Gwangmyeong Woori 은행 계좌, 발행 된 달은 발행 된 적이 없습니다.세 팀의 손실은 없었으며, 그는 ID 카드 사진을 찍어 저장했습니다.이 노출 후 해킹에 유출되는 것으로 알려져 있으며 금융 감독자가 확인했지만 두 개의 은행 계좌로 확인되었습니다.나는 질문을 받았다.그것은 가해자의 피해자 또는 이름의 피해자인지 확인하는 것입니다.요금이 많아서 연락했습니다.공개하려면 간단한 액화 사상자를 통과해야합니다.따라서 녹음을 조사하기에 충분하다고 생각합니다.사무실입니다.사무실입니다.콘텐츠를 알고 있다면, 당신은 그것을 모르는지 모릅니다.당신은 그것을 쓸 수 있습니다.당신이 맞습니까?Gwangju, Jeolla -do, Jeolla -do"
104,"예, 당신은 무엇입니까?나는 당신에게 몇 가지 사건에 연락했습니다.네, 맞아요.나도 몰라.장고는이 논문의 회장이 아닙니다."
108,김현 -킴현을 아십니까?이것은 우리의 기소의 경우이지만 이번에는 Kim Young Chic은 검 이었지만 Gungan은 많은 대포 청소와 관련이있었습니다.S -Stand Financial Bank의 계정 책이었고 은행 계좌는 거인에서 나왔습니다.사실이지만 계정 번호를 어떻게 알았습니까?은행 계좌를 발행했을 때 전화 번호를 받았을 때 저에게 연락했습니다.은행 계좌를 발행하면 전화 번호를 작성하지 않습니다.
110,따라서 확인에 연락했습니다.이 과정에서 저는이 이름으로 Uri Bank와 Hana Bank Bank 계정에 의해 압수되었습니다.
111,"예, 42 세의 은행 직원 인 Park Song을 알고 있다면 Jeolla-Do였습니다.어디서하고 있니?"
112,"저는 Park Jin -socks가 승리했습니다.나는 Kangho를 안다.예, 예, 김칸에게 물었습니다.은행에 계좌가 있었고 Dayin Securities Commercial이있었습니다.계정이지만 얼마 전입니다.4 월 7 일에 문을 열는 것이 맞습니까?지금은 전화가 될 것이지만 나중에 그것에 대해 이야기하지 않았습니다."
113,당신은 무엇에 갈 것입니까?김 칸을 아십니까?호?나는 첫 번째 은행과 Daishin Securities CMA 계정의 확인 확인을 발견했습니다.우리는 각 금융 부문을 확인했습니다.4 월 4 월입니까?알아?새로운 오프닝을 알고 있습니까?이 부분에서 나는 금융 범죄의 손해에 연락했다.일부 사람들은 백인 가족을위한 기금을 받았으며 은행 계좌를 팔거나 양도했습니다.계정을 판매하거나 양도 한 사실이 있습니까?다른 사람들에게.당신은 그것을 받아야합니다.귀하의 계정이 관련이 없음을 증명해야합니다.
114,"나는 37 세 -Kim Kang -Ho -Gu Man입니다.나는 37- 살인 남자입니다.이 과정에서 은행과 Daishin Security CMA 계정을 찾았습니다.나는 비난을 받았다.그는 계좌 개설, 은행 계좌를 이체하고 계정에 참여하거나 개인 정보를 잃어버린 경우 또는 금융 범죄로 인해이 부분이 손상되었는지 여부를 알게되었습니다.전국적으로 이루어 지지만 일부는 개인 정보의 유출로 인해 손상되었으며 일부 사람들은 돈을 받고 은행 계좌를 팔거나 양도했습니다.1 층은 세계가 파이에 대해 이야기하는 것입니다.당신은 그것이 당신의 목소리의 낚시라고 말했습니다.나는 당신을 데려 가거나 반대편에보고 할 것입니다."
116,"당신의 이야기를 들어보세요.예, 당신은 많은 노력입니다."
119,"이것은이 꿀입니다.저는 서울 조노 (Seoul Johnno) 지구의 검찰입니다.저는 서울 출신이고 37 세입니다.나도 몰라.예, 물었습니다.나는 또한 그것을 가지고 있었다.CM 계정.나는 두 개의 문서를 알고 있거나 전혀 알지 못합니다.그것은 그것을 열지 않았습니다.현장에서 발견되었으므로 동의없이 얼어 붙어 중단되었습니다.그렇다면 금융 부문은 유출 된 개인 정보를 지불 할 수 없다고 말했다.당신은 그것을 봤습니다.나는 전시 금융 회사의 직원으로부터 왔으며 쇠퇴 기간 동안 휴면 계정이나 개인 정보를 수집합니다.그것은 손상되었을 수도 있지만, 반대로 일부 사람들은 금액을 받았으며 은행 계좌를 가지고 있습니다.유선을 조사하십시오.의심이 확인되면 유선 조사가 중단되고 소환의 합이 수행되고 범죄가 청구되지 않으면 조사에 협력 할 것입니다.당신은 직장입니까 아니면 학생입니까?예, 이렇게하려고합니까?나는 나에게 동의한다.나는 동의 기록을 진행하는 데 동의합니다.Seocho -dong, Seocho -gu 또는 Seoul이 있습니까? 2017 년 12 월 8 일?3 년 안에 토지 가격이나 신분증 수표 카드와 같은 것을 잃어버린 적이 있습니까?나는 14 년 후 시작했다.14 년.질문은 여기에 있습니다.세 번째 손상이 발생할 수 있습니다.따라서 두 사람에 의해 손상되기 위해,이 둘의 손상을 얻기 위해 계정과 안전 조치가 취해집니다.동일한 개인 정보가 묶여 있지 않습니다.나는 당신이 당신에게 무엇을 말해야하는지 말해야합니다.나는 Nonghyup, Shinhan Bank 및 Kakao Bank를 사용합니다.가운이 좀 있어요.나는 Hana K -Bank를 알고 있습니다.처리 될 때 처리됩니다.창고에서 열었습니까?앞에서 언급했듯이 추가 계정은 우리에게 동결되었습니다.원시 카테고리의 경우, 그는 법적 소득이 있다는 부분 조사를 조사하기 위해 살았다 고 말했다.10 ~ 74에는 법적 자산이 있으며 60 개의 카카오가 있습니다.앞서 언급했듯이 나는 그것을 받아들입니다.궁금한 점이 있으시면 궁금한 점이 있으면 녹음 전화이므로 서울 센트럴에서 전화하십시오."
121,"휴대 전화가 연결되어 있습니다.우리는 당신에게 약간의 말을 할 것이지만, 우리는 현재 직장에서 여성이기 때문에 우리는 많이 판단하지 않으므로 처음으로 그렇게하지 않을 것입니다.거절하고 싶다면 거절 할 수 있습니다.사건의 다음 며칠 안에 있다면, 당신은 체포 영장을 위해 자신의 이름으로 남게됩니다.이 정보를 알고 있습니다.이 정보를 알고 있습니다.피해자의 입장을 받으려면 공식 문서 웹 사이트를 통해 공식 문서의 내용을 확인하고 절차 또는 절차의 탐색을 확인해야합니다.위에서 언급했듯이,이 경우는 금융 직원이기 때문에 전화를 걸 수 없으며, 끝나지 않으면 금융 부문이 제공하는 가족입니다.금융 부문에 들어가면 가방에 휴대 전화로 작업 할 수 있습니다.당신이 그것을 볼 때, 당신은 계속 자신을 열거 나, 당신과 당신의 직원을 당신 옆에두고 있습니다.다리를 건너 자신의 문서에 대해 이야기하는 경우에도 독특합니다.나는 10 분에서 15 분 사이에 전화를 호출합니다.그 당시 나는 당신이 Yowid 근처에서 먼저 기다려야한다고 생각합니다."
122,"그 남자는 전 Cookmin Bank 관리자로 지명 된 은행 직원이었습니다.이 재무 사건은 현장 요소가 아닙니다.건강을 유지하기 위해, 우리는 은행 재무 직원의 리더이며, 우리가 스스로 조사를 받으면, 우리가 제 3 자의 6 % 또는 노출 된 경우 미디어에 대한 것이라면 우리를 위해 혼란 스럽습니다. .집행 요원.녹음 과정에서 제 3 조 또는 기타 기계의 개발에 중점을 둘 수는 없습니다.당신은 그것을하고 있습니다.세 캐릭터가 들어오는 효과가 있습니까?나는 기원이있다."
123,"그래 나 여기있어.나는 영혼의 지원 사무실입니다.이제 조금 괜찮아요.예, 아닙니다.나는 남자 다.그러나 나는 위대한 예술가가 아닙니다.나는 그것을 잡았다."
124,"주요 자음은 땅과 혼합되어 있으며, 제 3 자의 목소리는 혼합되거나 말할 수 없습니다."
