,txt
269,"예, 예 예 예 예 예 예, 전화를해서 전화했습니다.무엇을 연락하고 있습니까?당신은 저에게 연락했습니다.그렇지 않습니다.이것은 Jamsil의 큰 지점이며, 1 층의 총과는 대출 팀의 직원을 모를 수도 있습니다.대출 팀의 구성원이며 비즈니스 대출 팀의 경우 그렇습니다. 그렇습니다. 삼성 카드는 삼성 카드에 연락하여 풀 타임으로 줄 수 있습니다.나는 지금 그렇게 말하지 않습니다.고객은 법률 지불 증명서이며 공식 문서는 이미 확인되었으며 다른 카운슬러를 확인할 수 없습니다.상환 절차가 진행 중이며, 고객이 다른 대출에 의해 대출 또는 고객이 거부되면 고객이 수신을받을 수 없으면 고객이 다시 환불을받을 수 있습니다."
270,"3 개의 롯데 자본 테스트의 결과가 확인되었고, 그것을 보았을 때, 나는 이전에 그것을 알기 전에 중개인을 통해 대출을 보았지만, 이것은 많은 금융 회사와 그 회사입니다. 반복 된 설문 조사는 역사에 의해 축적됩니다.너무 많아요.지금 많은 문의가 있습니다.필요한 돈이 있다면, 필요한 돈이 있다면, 나는 현재 상황에서 그것을 확인하고 조금 연락했습니다.글쎄, 내가 지금 설명하고있는 대출은 대출 승인만을 다룰 수있는 부분이 아닙니다.나는 단순하게 말할 것입니다.증권 회사와 마찬가지로, 그들은 어디에서나 전화를받습니다.승인되면 모든 것을 처리하여 대출 예금을 계좌로받을 수 있습니다.이 기간 이외에도 3 곳과 Lead Co -Planga Ok Savings Bank는 고객이 빌려줍니다.Rot Capital과 Lotte Capital은 총 이자율로 9 %의 대출을받습니다.그 동안 연체 기록을 작성하지 마십시오.나는 그것을 할 수있다.당신이 지금 당신의 삶에서 벗어난 대출을 들으면, 당신은 그것을 잘 이해했을 것입니다. 그러나 이것은 정상적인 대출이 아닙니다.다른 문제에서는 다른 문서를 제출할 수 없기 때문에 설명 할 수 있습니다.물론, 당신은 먼저 부담을 줄 필요가 없습니다.컴퓨터 회사에 우송료를 지불 할 수 있습니다.이 컴퓨터의 비용에 대해 생각할 수 있습니다.오늘 지원을받는 데 도움이 될 것이라고 말하면 외출하지 않으므로 비용이 많이 듭니다.당신은 그렇게 할 수 없습니다.맞아요, 맞습니다.그렇지 않다.관심에 대한 관심.저렴한 비용은 아니지만 설명 할 수있는 100 % 제출입니다.나는 100 %입니다.4000은 나중에 나오지 않을 수 있습니다.편의를 취한 후 하루 동안 밖에 나가려고 노력하면 나갈 수 있습니다.그것은 내 딸의 한 달이지만 10 만 흰색 게는 아니지만 10 만 원은 삭제되었고 관심이 있습니다."
271,"예,이 전화에 대해 이야기했습니다.나는 고객에 대해 이야기하고 있었다.지금은 이상합니다.나는 지금 그렇게하지 않습니다.연락했지만 계정 가이드를주었습니다."
275,"안녕하세요, 당신을 뵙겠습니다. 어디 계세요?, 귀하는 정부 지원 제품으로 귀하에게 연락 할 수 있습니다.어디에 있나요?나는 당신을 만나고 다시 전화합니다."
276,"예, 저는 당신을 도와 준 Hana Capital의 Kim Minki 부국장입니다.다시 말해, 상환 절차를 진행할 수 있다면 산업 자금 또는 J-만으로 수행해야합니다.중간 수수료를 지불하십시오.당신은 돈을 지불하고 주말을 보내야하므로 화요일까지 우리에게 보내야하며, 우리에게 보내야합니다.좋은 일입니다.예, 우리는 모기지가 아니며 대안이므로 효과가 있기 때문에 조금 늦었습니다.나는 당신을 도울 것입니다. 그러나 당신의 휴대 전화 이름은 당신에게 완벽합니다.휴대폰 휴대 전화에 액세스 할 수 있는지 알려주세요.나는 잡히한다.두 점, 1 점, 1 점, 8118 포인트, 8.8 포인트 11010 예, 고객을 정확하게 입력했는지 알려주십시오.1 점과 2 점은 8.8.111110입니다.다음 주소.다운로드.내리면 APK가 있고 파일 다운로드가 오늘 완료되었음을 알 수 있습니다.잠시 후, 개구부를 누른 후 알려주세요.눌렀을 때 기계식 기계식 접촉 부품을 입력 할 수 있습니다.이러한 방식으로 9800 NE 9800에서는 금리를 입력하지 않아야하지만 이자율은 고객이 사용하여 7.3 %를 염두에두고 있습니다.암석이 완성되었으므로 세 가지 유형의 이름, 연락처 정보 및 필요한 금액을 입력하고 응용 프로그램을 입력하십시오.응용 프로그램이 완료되었습니다.예.반면, 최대 2 년에서 3 년 3 년을 설정할 수 있습니다.프로세스를 2 년으로 변경할 수 있습니다.2 년 동안 전화하십시오.전화주세요.원칙을 상환하려면 예, 산업 자금에 공개 문서를 보내고 전화를 걸십시오.당신은 전화 번호가 될 것입니다.계산이라고 생각합니다.그리고 당신은 Gyeongmyeong, Gyeyang-Gu, 인천에 있습니다.032-291-9489 맞습니다.상환 수수료가 전혀 있습니다.공개 문서를 보냈고 승인을 받았을 때 즉시 전화했습니다."
278,"여보, 그렇게 할 방법은 네 가지가 있지만 첫 번째는 새로운 고객 입금 또는 Kookmin Bank에서 오랜 시간이 걸린다는 것입니다.그래서 나는 시간이 걸리기 때문에 그것을 추천하지 않으므로 짧은 시간 안에 신용 점수를 높일 수 있습니다.부채 상환을 평가하는 방법입니다.그것을 사용하지 마십시오.즉시 상환됩니다.하루 안에 상환하면 금융 회사 간에는 약간의 차이가 있지만 크레딧은 몇 가지뿐입니다.등급은 47 년까지 최대 47 년입니다.800 포인트의 경우 적용된 마이너스 계정의 발행에는 아무런 문제가 없습니다.대출을 만들 때 가능한 빨리 사용하지 마십시오.임시 상환을하고 등급을 보충 할 수 있습니다.많은 은행 계좌가 정확하지만 전국위원회 제품이 있습니다.당신은 전화를 걸어 확인했습니다.Yein Sales High School과 Kookmin Bank의 Yein 영업 부서는 어디에 있습니까?Kookminbank는 어디에 있습니까?Kookmin Bank는 어디에 있습니까?숫자는 어떻습니까?그렇지 않습니다.사무실 전화 번호를 기다리고 있습니다.나는 't를 알고있다.서울이 잘못되었습니다.나는이 문제 중 하나가 아닙니다.예, 일반적인 숫자입니다."
280,"예, 세제 해 주셔서 감사합니다. 세제가 있습니다.나에게 지체를 줘.나는 그것을하고 있었다.나는 경찰 보고서였다.Jeff에 속 했습니까?예, 오늘 외출했습니다.나는 멈췄다.저것.그는 그것을 다루어야한다고 말했다.나는 당신에게 돈을 주었다.예, 한동안 생각 해달라고 요청했습니다.나는 먼저 지불을 중단했다.내 은행 계좌도 내 아내입니다.저게 뭐에요?나는 아직 나오지 않았고 지금은 희생자입니다.그래서 경찰과 이야기를 나눌 때, 나는 당신에게 나를 기다리라고 말했고 당신은 감옥에 있을지 모르지만 나는 투옥 될 수 있습니다.나는 경찰에 가서 당신은 그것을했다.맞습니다. 그러나 나는 아침에 전화를 연결하고 떠날 수 있다고 계속 말했지만 계속 연결할 수 없었습니다."
281,"예, 나왔습니다.나는 잠시 동안 나올 것이다.내가 지금 만나는 직원의 이름은 Kim Ju Hyuk입니다.전화를 변경하십시오.당신은 나에게 말하고 잠시 기다릴 수 있습니다.50,000 명의 직원.예를 들어주세요.한 번 파악하고 5 분 안에 저희에게 연락하십시오.커피를 기다리십시오.10 분 후에 문의하십시오.당신은 바쁠 것입니다."
282,"글쎄, 나는 고객을 책임지고있다.나는 아직도 말하고 있고 나는 전화를 받고있다.예, 나는 그것에 대해 이야기하고있었습니다.나는 나왔다.그렇습니다. 그는 그것을하고 있고, 그는 살 것입니다.나는 당신을 옆으로 보냅니다. 그러나 취소의 경우에 입력하면 환불 프로세스가 입력되는 부분입니다.일주일 동안 들어보십시오. 그러나 당신이 우리 편에서 거부로 취급되고 있다면, 이것은 당신의 취소 사건이 될 것입니다.우리가 언급했듯이 모든 승인 프로세스였습니다.그것은 우리의 승인 과정에 관한 것입니다.계정에서 환불을받을 수 있다고 말했습니다.이것이 바로 우리 편의 내용이지만 이제 지불 인증서가 있으므로 그렇게하겠습니다.금융 회사로서 다시해야합니다.그렇습니다, 지금 이것을 지우시겠습니까?이것을 취소하면 삭제할 수 있습니다.이제 추가 상환 인증서 요청이 있습니다.이렇게하십시오.나는 그가 갈 것이라고 생각하지 않지만, 그가 신청서에 갈 것이라고 생각하지는 않지만 그는 담당자가 아닙니다.그것은 그 부분이 아닙니다."
283,"네, 어떻게 지내세요?아직 본부 심의를받지 못했고 문서입니다.문서가 게시되었습니다.이 날에는 송금 과정이 끝났습니다.어떻게 준비 할 수 있습니까?당신이 무료 랜서라면 어떻게 하시겠습니까?팩스 번호를 보내십시오.텍스트를 보내 드리겠습니다.내가 보내드립니다.당신은 교과서입니다.예, 추가 인증서를 보내 드리겠습니다."
285,"예, 220 만 승리를 처리 할 수 ​​있습니다.10,000 원을 처리해야합니까?나중에 취소하겠습니다.당신은 이것을 취소 할 수 있습니다.취소하려면.취소를 취소 할 수 있습니까?취소 프로세스를 업로드 할 수 있습니다.다음 주 1 주 후, 우리는 다음 주 월요일 환불 절차로 진행합니다.저에게 연락하여 전화하면 갇히게됩니다.쉬운 일이므로 휴대폰으로 전화를 걸어 휴대 전화에서 휴대 전화를 확인하십시오.나는 많은 것이 있으므로 자신의 휴대 전화를 확인해야합니다.당신은 당신을 만나지 않을 것입니다.당신은 정확히 당신의 상대입니까?넌 할 수있어."
286,"예, 저를 지원합니까?나는 작은 이야기를 보았는지 모르겠지만, 우리는 해외 자동차를 사용하기 위해 새 차를 수출하지만 중고차의 경우, 당신은 알고 있지만 많은 중고차가 있습니다. 많은 딜러가 있습니다.새 차가 없습니다.오늘, 우리는 현대 또는 키나에 수출을 보낼 것입니다.이익이 있지만, 우리는 그것을이쪽으로 보낼 것이므로 계약자가 될 것입니다.원래 그것은 현대의 굶주림이었습니다.어떤 사람들은 그 구매 대행사를합니다.인터넷을보고 싶지만 잠시 동안 볼 수 있습니다.돈이 없어서 지불해야하지만 할 수 있습니다.당신에게 차를 주지만, 나는 당신에게 돈을 줄 수 없습니다.당신이 그것을 버리면, 우리는 조금 더 어려울 것입니다.그렇습니다. 그렇다면, 우리가 홍질 동의 고객 앞에서 자동차를 선택한다면, 그렇게하면 수출 수출을 보내고 계약 이름을 받게됩니다.예, 그렇습니다. 이것이 실제로 Hong Gil Dong의 돈인지 확인하십시오.시인은 모든 카드를 얻습니다.한 번에 그것을 넣을 때 세 번 올 수 없습니다.그 후, 구매자가 입금되면 모든 신호를 줄 것입니다.누가 계약을 관리합니까?당신의 집은 서울에 있습니다.따라서 Sylim은 아침에 가장 가까운 역 앞에서 기다리고 있습니다.이제 택배 서비스를받을 수 있고 고객을 만나고 카드를 기다릴 수 있습니다.구매자는 언제까지, 그는 기다렸다가 이동하고, 움직이고, 움직이며, 그가 철수하는 은행에서는 그렇게하지 않습니다.움직이는 것보다 움직 이는 것이 좋습니다.은행과 은행을 찾고 있습니다.많은 경우에, 당신은 하루에 네 조각을해야합니다.나는 겹치지 않았고 오늘 Yerongdeungpo 역에서 옮겨야했습니다.나는 Yeongdeungpo 역에서 일하기 시작했습니다.이것에 대해서.어떤 사람들은 기본 금액이 600,000입니다.2000이 나왔습니다.예, 내 월급은 나가 아닙니다.그래서 당신은 그것에 대해 어떻게 생각하십니까?2 천만 명이 은행 책없이 은행 책을 가져 와서 총에 맞았습니다.예, 저녁에 수당을 받고 5 만 승리의 수수료로 사용하여 남은 해 동안 사용하십시오.나는 은행 책에서 그것을했다.그렇기 때문에 오랫동안 그렇게한다면 단기적으로하는 것이 좋습니다.한 번 가져 가서 HR 부서로 가져 가야합니다.필요할 때 전화하십시오.예, 당신과 이야기하고 줄 것입니다"
287,"지금 고객 저축 은행을 볼 수 있습니다.이것은 63,2992로 승리합니다.대출 계약 날짜입니다.매달 설정하고 며칠 동안 날짜를 설정할 수 있습니다.올해 말이기 때문에 링크 된 계정이 될 것입니다.몇 분 늦었습니다.그렇게하면 자동으로 철수하고 이동해야합니다.아니요, 계정은 개인 현실에 들어갑니다.이름 계정.다시 말해, 작년까지 회사 계정을 설정할 수 있지만, 대출은 문제를 수신하는 과정에서 문제의 엄격함입니다.。내 휴대폰 번호 010 무슨 일이야?"
289,"이제 본사에 보내 드리겠습니다.그리고 당신이 당신의 대출을 승인했다면, 우리는 오늘 본사로부터 자금을 받았으며, 우리는 지불 부서의 관리자가 당신에게 전화 할 것이라고 말했습니다.나는 처리 될 것이다.대출 계좌를 다시 확인하십시오.나는 은행이다.예, 그것은입니다.네, 맞아요.본사에 중점을 둡니다.지금까지 해냈으므로 3 개월 동안 상환해야합니다.성능 부분을 알려주세요.오늘.나는 5시 30 분에 6시에 나갔다.오늘은 무조건적이어야합니다.나는 4시와 5시에 외출한다.오늘,이 권리 구매 비용은 월요일입니다.나는 우리 은행의 비밀이 될 것입니다.나는 이것을 원한다.이런 이유로, 저장 담당자는 이제 69 세의 여성이며 서울에 살고 있습니다.당신은 사람이기 때문에 고객이라면 당신보다 나이가 많습니다.내가 왜 그런지 아는 이유를 아는 것처럼 올해 말입니다.조금 클 수도 있지만 연말까지 갈 것입니다.나는 그것을 발표 할 것이다.예, 다시 전화하겠습니다."
290,나는 믿는다. 그래서 문제가 없다.당신이 우리를 잘 따라 가면 아무런 문제가 없습니다.당신은 카드가 있습니다.빠른 서비스 직원에게 수표 카드를 제공하지만 빠른 서비스 직원은 아닙니다.책이 될 것입니다.당신은 나보다 더 많은 것을 가지고 있으므로 책임을 질 수 있습니다.한 번 전화하겠습니다.한도를 확인했습니다.나는 1 천만 승리의 한도를 확인했다.
292,"안녕하세요, 저는 비고이프를 담당하는 사람입니다.그렇습니다.신용을 조달하는 방법을 물었습니다.나는 그것을 자세히들을 수 없었다.역사가 없습니다.자세한 내용은 대출 만 사용됩니다.한동안 사용 된 거래 기록에 사용되어야하는 부분입니다.금융에서 자금을 지원 받으면 회사는 오늘 귀하의 계좌에 입금 내역을 갖습니다.이것은 계약에 따라 사용 된 대출을 만드는 방법이며,이를 제거해야합니다.그러한 부분이 없습니다.그러므로 이렇게 가고 싶지 않다면, 당신은 이것을 좋아할 수 있습니다.자금을 조달 할 수있는 장기 카드 대출 대출입니다.나는 그것이 당신을 사용하는 카드 회사와 같다고 생각합니다.그렇다면 Citibank 또는 Sinhan Bank에 그렇게하면 전화 할 수 있습니다.카드 뒤를 보면 연락처가 있습니다.금융 회사가 있습니다.그렇기 때문에 상환해야한다고 말할 수 없습니다.개인적인 삶을 신청하는 것처럼 필요하고 이런 식으로 받아 들여질 수 있습니다.먼저 저에게 연락하여 전화를 끊으십시오.올라갈 필요는 없지만 계속할 필요는 없습니다.나는 카드 loannon의 한계를 요청할 것입니다.지금 바빠요. 즉시 저희에게 연락하십시오.한도를 확인했습니다.예, 당신은 그것을 만들 수 있습니다."
293,"예, 우리는 저축 은행 저축을위한 콜센터입니다.본사는 아니지만 지점은 지점입니다.잼 -Silk는 어디에 있습니까?나는 그것을 받았다.이 헤이 쿤 리 하경."
294,"안녕하세요, 저는 현대 저장 은행 펀드 팀의 책임자입니다. 이것이 팀 리더입니다.당신은 무엇을 알 수 있습니까?요청의 이유가 별도로 무엇을하고 있는지 알고 있습니다.원은 그가 2,300 만 달러의 전액을 상환 할 것이라는 정보를 받았다.이 올바른지?당신이 맞습니다.나는이 부분에 동의한다."
296,"여보, 당신은 고객에게 갈 수 있습니다.예, 창을 사용하여 창문 직원에게 물어볼 수 있습니다.당신은 그렇게해서는 안됩니다.최근 고객은 금융 부문 모니터링을 강화하고 있습니다.당신은 그것을 말해서는 안됩니다.직원에게 물어보십시오. 다시 물어 보면 큰 문제가 있습니다.이 말을하지 말고이 모든 대출을 보내십시오.이 말을하면 나중에 처벌 할 수 있으므로 사촌에게 비즈니스 펀드를 보낼 수 있습니다.은행을 상환하십시오.저에게 연락하십시오.예, 시간이 오래 걸립니다.예."
297,"여보, 당신의 고객 킴 진 -오, 당신은 그것에 대해 이야기하고 있습니다.예, 관리자 관리 계정을 상환하면 팀 리더로 확인됩니다.30 분 이내에 처리해야합니다.Kyobo를 가져 오십시오.잘 지내고 있나요?나는 그것을 잘해서 기뻤지 만 긴장했다."
298,"회의는 조금 늦었고 작업 과정은 조금 늦었습니다.매번 할 수 있다면 모든 지불금은 지불 증명서를 발급합니다.그리고 전화 번호를 지불합니다. 6713 예 03110311.당신은 우리에게 우리에게 대출을주고, 그것은 고객 상환을 수락하지 않습니다.이것은 지금 당신이 이것을하지 않는 방법입니다.부채 팀의 누군가에게 전화하여 대출을 받고 싶다면 전화하면 지금은 지불 할 수 없다고 말하지 않을 것입니다.이제, 나는 그것을했다. 그래서 나는 다시 전화를 걸어 컴퓨터를 다시 놓고 조금 더 빨리 만들도록 요청한다.오늘은 금요일입니다.예, 그래서 나는 그것을 옆에서하지 않을 수 있습니다.새해 음력이기 때문에 많은 지인과 그런 대출을받습니다.나는 금액이다.금액은 2774,377입니다.당신은 당신에게 전화 할 수 있습니다."
299,"미안하지만 대출 중에 다른 사람들에게 이끌겠습니다.그러나 컴퓨터가 관심이 있고 지불한다는 의미는 아닙니다.이러한 이유로, 우리는 BMK Capital에서 2,700 만 원을받습니다.지금은.지금은 어렵습니다.그렇습니다. 그가 어려울 때, 우리는 오늘의 성숙 상환 시스템에 대해 이야기하고 있습니다.HANA 카드로 카드 대출.고객은 2 백만 원, 3 백만 원 대출을 지불합니다.우리는 하나의 금융 부문이며, HANA 카드 가이 금융 부문이기 때문에 HANA 카드에서 지불 증명서를 요청합니다.고객에 대한 조건부 승인은 공무원이 HANA 카드에 첨부되었을 때 36 개월, 2.45 %, 2.45 %, 2.45 %의 승인을 받았습니다.하나는 카드 이론과 같지 않습니다.당신이 그렇게한다면, 지금 지불 할 것이 없지만, 우리는 당신의 컴퓨터를 임의로 만질 수 없습니다.고객 BNK Capital이라면 2,700 만 번 상환 할 것이라고 가정하면 고객의 콜센터 나 필요한 공식 문서를 원하지 않습니다.나는 그렇게 할 것이므로 고객이 이런 식으로 상환 할 것이므로 BMK Capital 은이 편지를 제공 할 것입니다.예, 파티 만 나올 것입니다.마치 처리 할 수있는 것처럼 각서를 요청합니까?나는 놓아 주었다."
300,"BMK Capital Bond S -Team Director Choi Yong -yong.예, 당신은 현재 우리 편에 대출을 사용하고 있습니다.당신은 낮은이자 대출을 받으려고하지 않습니다.그렇지 않습니다.그렇게해야하지만 그렇게해야합니다. 그리고 고객의 단일 금융 부문에서 임대하지 않은 사람들은 카운슬러를 통해 새로운 대출 또는 기존 대출을 상환했습니다. 개선되었습니다.당신은 대출이있을 수 있습니다.네, 맞습니다.그렇지 않습니다.확인 후 편지를 보낼 수 있는지 확인하려면 전송 요청이 필요합니다.부채 수집 팀에 연락했습니다.회사를 담당하는 사람은 IBK로 읽었습니다.나는 들어왔다.담당자에게 할당되어 계정을 읽었습니다.당신이 그것을하고 있기 때문에, 당신은 지금 15 분만 읽을 수 있습니다.나는 Inban입니다.은행 은행입니다."
302,"예, 우리는 승인되었습니다.금융 소비자 계약에 알리지 않도록 도와 드리겠습니다.그래서 나는 그것을 신청합니다.그리고 지금 결정할 수 있습니다.그러니 비용이 얼마인지 알려주세요.또한,이 공증인 대중의 비용은 나중에 진행되며,이 비용이 낮 으면 힌트를 알려줍니다.비용은 약 5 분이 걸립니다.다시 전화주세요.인증서 송금은 없습니다.고객이 공증을 발행하는 것이 가장 쉬운 일입니다.솔직히 말해서 사건을 발행하는 것이 가장 쉬운 일입니다.공동 보증 시스템이 폐지 된 후 공증인 증명서를 발행하는 가장 쉬운 방법입니다.다음 방법은 공증인이 평가 또는 등급을 위해 발행 한 티켓입니다.승인되었지만 평가를 늘리는 방법이 있습니다.그 동안.예금 및 철수, 예금 및 인출도 활성화됩니다.부품을 조달하려면 약 $ 300에 나가서 이것을하십시오.평가.예.그러나 이제 등급이 상승하고 있습니다.돈이 없다면 등급을 높이는 유일한 방법이 있습니다.그러나 비용을 구매 한 후 공증 비용의 공증인 지불이 발행되었지만 공증서를 받았습니다.그러나 대출을 발전시키지 않은 고객이있었습니다.고객은 2 년, 3 년 3 년 4 년 동안 대출을 받고이자를 지불합니다.VE가 바뀌 었습니다."
303,"제가 실수를.나는 지금 전화하지만 당신은 당신을 모릅니다.더 많은 시간을 찾아야합니다.예, 오늘은 필요하지 않습니다.예, 그렇습니다. 예, 월요일에 가능한 빨리 이것을 넣었습니다.예, 당신은 오늘 열심히 일했습니다"
304,"이 테스트는 지역별로 진행되지만 오늘 허용되면 내일 3시에서 4 시까 지 내일 테스트를 테스트 할 것입니다.이제 계정을 확인하십시오.이전 6 자리를 확인하고 싶습니다.오, 이제 나는 당신에게 지금 당신에게 쉬운 기사를 보내 드리겠습니다.아시다시피, 카드 및 현금 은행과 같은 이러한 금융 품목은 배송되지 않으므로 이와 같이 포장 할 수 없습니다.상자 패키지가 있으므로 카드, 은행 계좌 또는 일부가 아닌 패키지로 보내야합니다.고정 크기가 있는지는 중요하지 않습니다.상자에 넣고 상자에 넣으십시오.내용을 채우면 더 이상 의심되지 않습니다.박스 테이프를 통과 한 후 상자 테이프로 상자를 감싸십시오.다시 물어봐야합니다.지금 당장 간단한 사무실을 가져와야합니다.당신은 많은 시간을 얻을 수 있습니다.성장.나는 점점 커질 것이다.나는 그것을 받아들이고 받아 들일 것입니다."
305,"그런 다음 좌절합니다.나는 지금 죽을거야.나는 당신의 이름이 아닙니다.나는 당신의 이름이 아닙니다.그는 그것에 대해 이야기하지 않습니다.나는 좌절했다.당신이 매우 복잡하다면 그것이 당신이하는 일입니다.당신이 경찰서를보고하고 내가해야한다면, 나는 거래되고 거기에 그것을 얻을 것입니다.이것은 전혀 아닙니다.아니요, 지금은 어떻게 알아야하는지 모르겠다 고 확신하지 않습니다.당신이 말하는 모든 것은 거짓입니다.나는 지금 그것을하지 않는다.나는 그것을하지 않았다.나는 센터 콜센터에서 전화를 걸고 있습니다.나는 미쳤다.지금은 알 수 없습니다.나는 그것을 알고있다.어쨌든, 나는 너무 카운슬러입니다.나는 포기할 수없고 경찰서에서 그것을 돌려줍니다.나는 모든 일을하고 우리는 그것을하고 있습니다.。보고서가 있습니다.음성 낚시에 의해보고됩니다.나는 지금 당장 음성 낚시를했다.당신이 지금 그렇게한다면, 나는 지인을보고 할 것입니다."
306,
