,txt
403,"Nonghyup Bank 계좌의 Kookmin Bank Mapo -Gu의 Dohwa 지점에 문을 열었습니다.나는 이제 체포되었습니다.키가 크면 기억하십시오.은행 계좌가 개설 된 은행 대신 Kokmin Bank의 Nonghyup Bank는 3 개의 샘플에 있습니다.사용 권한의 법적 사용을 제외하고 나머지 금융 부문이 완료됩니다.나는 지금 모른다.오, 나는 김현민이라는 사람이다.그러나 우리는 Kim Hyunmin을 광고 한 사이트에서 우리는 이전에 살았던 많은 신용 카드와 대포 은행을 보유하고 있으며, 이제 Kookmin Bank, Nonghyup Bank, 그리고 지금은 상태의 이름 아래에 있습니다.당신이 김현의 최소라면, 당신은 전에 알 수 있습니다.이름은 Kim Hyunmin입니다.나는 불법 도박 사이트를 의심하는 데 김현을 추천했다.Saemaulundong의 확인을 찾았으므로 연락했습니다.나는 검찰의 분야에 많은 신용 카드를 가지고 있었고 대포를 가져 왔습니다.그 이후로 나는 그것에 관심이있었습니다.지금.나는 처음 연락했다."
404,"이 모든 기록은 피해자를 증명하기위한 증거로 법원에 제출됩니다.방금 나에게 물었다 고 말했다.당신이 일할 때의 장소.마이너스 은행 계좌 철수는 어떻게 되나요?은은 단 하나뿐입니다.예, Kookmin Bank에는 무료 예금, 서랍 또는 2 개의 예금이 있습니다.총 3 개의 계정이 있습니다.그러한 계정은 없습니다.문제가 있었기 때문에 우리의 사상자가 내 계정에서 100,000을 얻었다고 생각했습니다.소년과 계정의 올바른 균형은 얼마입니까?성명서를 요청하고 싶습니다.귀하의 개인 정보에 대해 물었습니다.예, 저는 응급 치료실 아래에 있습니다.지금 저에게 연락 했습니까?지금 뭐하세요?그렇습니다. 우리는 김간을 주요 범인으로 체포했습니다.이 과정에서 나는 크라운 은행 계좌와 신용 카드를 사용했지만 이제는 Nongyup Bank와 Hana Bank 사이에 두 개의 금융 은행 계좌를 발견했습니다.은행 계좌에 대해 연락했지만 우리는이 두 홀에 연락했으며 2016 년 4 월 22 일에는 두 개의 은행 서적 인 Cheolsan -Dong이 있습니다. .당신이 열었다는 사실이 있습니까?그렇다면, 그렇다면, 지난 3 년 동안 개인 정보 나 여권 지갑 또는 여권 지갑을 보러 오면 사용하는 경우 사용하는 경우 은행 또는 은행에 4,900 만 이메일이나 교과서가 없습니다. 포털 사이트 또는 Naver Facebook 하트 포털.현재 두 개의 금융 은행 계좌가 발견되었습니다 : Nongyup Bank와 Hana Bank.현재 Chorsan -Don 브런치에있는 사람의 이름.지점이 없습니다.현재, 나는 지난 3 년 동안 내 신분증이나 개인 정보 또는 운전 면허증을 포함한 조건으로 잃어 버리거나 도난당한 적이 없습니다., 포털 사이트 Interpark, Naver, Facebook.아니요, 60을 조사하려는 두 가지 항목이 있습니다. 신원을 확인하기 위해 연락을 받았기 때문입니다.현재, 그것은 자신의 이름으로 열렸으며 불법 예금 계좌였습니다.당신이 나에게 양도되지 않았다면, 나는 개인 정보의 유출에 대한 또 다른 PR을 얻었습니다."
405,"다음 주 금요일, 나는 법원의 회원이 될 것입니다.커뮤니케이션 레코드를 확인하려고했습니다.커뮤니케이션 기록의 결과로 Kim Han San 또는 Kim Hwan-Sung에는 전화 기록이 없었습니다.Kim Wang San과 Kim Wang San은 의심이나 불만이 없습니다.나는 일부 검사를 양도 할 것입니다.180 명과 관련이 있습니다.인원을위한 조사를 이끌지 않는 사람들에게는 당신과 같은 존 껌이없는 사람들 일뿐입니다.질문을 묻습니다.예, 당신은 녹음 파일의 형식입니다.같은 것이 나쁘면 조랑말 증거로 채택하기가 어렵 기 때문에주의하십시오.나는 지금 괜찮아.지금 어디에 있습니까?기다리세요.나는 검찰청에서 Kim Young을 조사했다.검찰의 고등학교 범죄 ATM 조사관이라고합니다.당신은 김 한슬입니다.나도 몰라.당신은 전혀 모릅니다.Gwangju, Jeolla -do, 42 -ell -Old Kim ha -in.금융 범죄 사기의 경우 Gwangju, Jeolla?검사관은 많은 신용 카드 또는 대포 계정에서 발견되었습니다.그것은 함께 발견되었고 관련 금융 부문을 통해 확인 했으므로 확인 했으므로 아침에 해냈습니다.나는 그 경험으로 돌아왔다.은행 계좌가 열렸는지 알 수 없었습니다.귀환이 없었습니다.확인 차량을 얻었습니다.당신이 Cheonho를 알고 있다면, 당신은 모릅니다.우리는 검찰 측의 주요 범인 중 하나를 광고했지만 신용 카드와 대포 계정은 Geomdan 사이트에서 발견되었습니다."
406,"나는 좋은 사람입니다, Jung Tae -Jun.이것은 게임 영역에서 활동을 아는 사람입니다.올해 40 세대 Male Nonghyup Bank는 같은 10 년이되었습니다.범죄 사기이지만이 권고안에는 Jung Tae -Joon이라는 친구가 자신의 이름으로 Nonghyup Bank와 Hana Bank의 기계가 있어야합니다.Bankbook은 돈을 지불하고 일부 진술이 있습니다.사실입니다.17 일, 그것은 cheolsan -dong, gwangmyeong -si, gyeonggi -do입니다.가수의 천장으로 품목을 분류하고 압수하는 과정에서 Nongyup Bank와 Hana Bank 계정은 제 이름으로 발견되었습니다.이런 이유로 사실을 확인하기 위해 전화를 걸었습니다.17 일에는 평일과 화요일이었습니다.약 5 개월 전, 각 계정이 Cheolsan -dong, Gwangmyeong -Si 및 Gyeonggi -do에서 개설되었음을 확인했지만 졸업생은 아닙니다.모든 부상 환불 조치가 취해졌습니다.그러나 현장에서 압수되었을 때, 두 개의 비고이프 계좌에는 불법 자금이 790 만 명으로 3 천 8 백만 개의 HANA 은행 계좌가 포함되어 있습니다.이 사건은 Kim Ho -Cheol이 온라인 판매자로 등록되어 비싼 항공편과 기프트 바우처를 게시하여 더 저렴한 가격으로 판매 한 것입니다.번호를 알리고 돈을 보내도록 보내고 싶습니다.돈, 그리고 나는 그것을하지 않았다.물건을 사기 위해 돈을 보냈지 만 처음에는 도착하지 않고 연락 할 필요가 없습니다.불만은 지금과 지금까지 접수됩니다.나는 당신이 자유롭게 도와 드리겠습니다.나는 금융 감독 서비스의 진술을 통해 은행 계좌에 대한 동결 계좌를 발전시키고 싶지 않습니다.어디에 있나요?제발.금융 기관의 이름을 알려주세요.Saemaur의 거리가 없습니다.예, 귀하의 계정이 올바른 경우 무료 계정 동결 처리를 계속하지 마십시오.500,000 원 오류, 나는 그것이 옳다고 판단합니다."
407,"당신은 그것을 naver에 사용합니다.당신은 그것을 사용하고 있습니다.당신은 사이트가 무엇인지 알고 있습니다.내가 제품을 보내지 않았기 때문에 7 명의 사상자만이 자살 혐의로 기소되었고 향후 고발 혐의로 기소되었습니다.현재 체포 영장으로 체포되었습니다.여기서 첫 번째 의심은 Kim Ji Hyuk 또는 통화 또는 텍스트의 세부 사항에서 찾을 수 없으므로 1 년 및 6 개월의 통신 레코드가 있습니다.우리는 첫 번째 청구가 없으며 전체 설문 조사 프로세스에 유용 할 것이라고 판단합니다.당신은 당신이 무슨 뜻인지 알고 있습니다.Kim Ji Hyuk Pass 또는 금융 범죄에 동의하십니까?이것이 우리가 이것과 내 이름의 첫 번째 은행 계좌 중 하나를 발견했기 때문에 우리가 당신에게 연락 한 이유였습니다.2013 년 11 월 7 일에 42 세의 맨 Kim Jae -Huk가 태어났다는 것을 알고 있습니까?이제 아무도 아무것도 피하지 않았습니다.나는 해자 였기 때문에 Gangawasan을하지 않았다.나는 Unyun에 들어갔고 나는 고속도로에있다.사고를 수리하면서 조금 조사하는 것이 좋은 일이라고 생각하지만 몇 가지 질문을합니다.공식 공식 문서를 읽으십시오.첫째, 서울 중앙 검사는 김입니다.영 -chul.나는 그것을 키우고 매우 싸게 팔았습니다.나는 그것을받지 못했다고보고했고, 좌익 사건은 오늘 증명해야 할 부분입니다.필드를 찾았을 때 은행 책 소스에 대한 설문 조사를 수행해야합니다.또는 유출 된 사람으로 사용 된 피해자의 신념을 다루기 위해 설문 조사에 연락을 받았습니다.개인 정보가 있다면 지난 3 년 동안 유출되어 지갑 여권 휴대폰에서 길을 잃거나 길을 잃었습니까?"
409,"예, 그렇지 않습니다.제품을 전송하지 않고 중간에 작은 욕설에 서명 한 세 가지 사례를 보았습니다.이 예금을 일으키는 은행 책이 있습니다.피해자의 희생자가 있습니다.그러나이 불만으로 무엇을합니까?저는 현재 은행 계좌에 대한 은행 계좌로부터 불만을 접수하고 있습니다.은행 금융 부문을 포함하여 총 18 건의 사례를 받았습니다.불만은 추가 조치이며 진행할 수있는 증거는 없습니다.다시 한번, 나는 당신에게 질문과 답변으로 물을 것입니다.그래서 저는이 부분을 녹음 기록으로 남겨 두고이 녹음 테이프를 내 증거로 제출합니다.그러나 주식이 완전히 입력되면 사건을 담당하는 검사에게 양도됩니다.그래서 우리는 우리가 기록하기 전에 몇 가지를 묻습니다.피해자는 피해자의 피해자에 관여합니다.외출 할 때 우리는 동일한 회사 계정과 같은 회사 계정을 사용합니다.다시 연락주세요.나는 당신에게 무언가를 물었습니다. 그러나 당신은 의심 스럽습니다.연락하는 것이 좋습니다.나는 매우 조심합니다.다시 연락 드리겠습니다.예, 그렇게하는 것이 좋습니다.참조 할 교과서가 있기 때문입니다.불법 분야에서, 우리는 비 지정 은행 HANA Bank가 은행 계좌에 불법으로 사용되며 발견 직후에 확인되었음을 확인했습니다.나는 Grohinjin의 기금을 받아 들였지만, 나는이 부분에 동의하지 않습니다.-Seok은 그가 매일 파티를 가질 것이라고 말합니다.조금 있습니다.계정 추적이 자신의 이름으로 계속 될지 여부.출혈 상태 나 개인 정보에 대해 묻지 않습니다.나는 대조적이며, 불법이기 때문에 외부 사물이 혼합되어 있는지 신뢰성을 찾고 있습니다.자세한 자금을 찾으십시오. 그러나 그것은 돌아 왔습니다.당신은 그것을 할 필요가 없습니다"
410,"은행 시간이 끝났기 때문에 발행 할 수 없습니다.나는 예수를 찾아야하고, 우리는 그것을 생산해야합니다.그리고 당신이 지금 우리에게 그것을 보내면, 우리는 그것을 생산할 것입니다.나는 전혀 모른다.이것은 현재 초대장이며, 우리가 알고 싶은 것은이 Nongyup 및 Hana Bank 계정에 직접 열었고 Kim Hyun -Joon이라는 사람에게서 불법적으로 이적했다는 것입니다.그것은 도둑질의 이름의 희생자였습니다.휴대 전화가 개인 정보로 유출되었다는 손실이있었습니다.냉장고가 무엇이든, 엘리베이터는 이제 Kim이라는 비 지시 직원입니다.비 실행 속도가 어디에 있는지 알고 있지만 많은 주입 선택이있는 건설 현장에서 체크 카드를 조사하고 있습니다.DEG 본사.나는 당신에게 연락했지만 당신은 충성도가 있습니다.이것은 Kim Ji -Huku입니다.나는 아는 사람으로부터 들어 본 적이 없다.약 30,000 원입니다.그것은 또 다른 자료입니다."
412,"이것은 Suwon District 검사 사무실입니다.작전, 나는 Kim Young -Soo를 알고 있습니다.당신은 당신이 그것을 모르는 것을 알고 있기 때문에 당신이 모르는 것을 알고 있습니다.연락하십시오.나는 나와 함께 확인하고 잠시 동안 연락했다.당신은 잠시 동안 이야기 할 수 있습니다.당신이 처음으로 Ann Kim Young이라는 것을 알고 있습니까?사실을 확인하기 위해 연락 드리겠습니다."
413,"현재 Sinhan Bank의 경우 마지막 계정은 아직 결과가 아니지만이 계정에는 세탁 기록이 없습니다.나는 이미 당신에게 연락했다고 생각합니다.우리는 그것을 패널로 만들었습니다.돈에 대한 세탁 기록이 있다고 생각합니다.3 백만 또는 천만 원이더라도 세탁 기록이 나타날 수 있습니다.검찰 사무실, 킴 지 한.방 안에 진정한 부모가 있습니까?연고를 방문해야 할 이유가 있습니다.계정을 살 필요가 없습니다.나는 당신에게 말한다.나는 그것을 가지고 있지 않다.사실이 있고, 보고서, 인터넷 뱅킹이나 텔레 뱅킹을 사용합니다.이것은 내 은행 계좌입니다.나는 문을 닫았다.은행 계좌가 두 개 있습니다.은행 계좌는 어디에 문을 열었습니까?"
414,"예, 나는 거의 기록하지 않고 다시 한 번 질문을 기록합니다.나는 그것을 먹지 않는다.더 자세히 설명하겠습니다.그것을 다루는 방법을 어떻게 이해 했습니까?약간의 이상이있을 수 있습니다.나는 시간이 많지 않기 때문에 먼저 음성 레코드로갑니다.확인을 위해 연락했습니다.예, 전화로 괜찮습니다.예, 나는 'LL을 요구합니다.Moon Huyei Kyung을 중심으로 한 금융 범죄 사기였습니다.Gwangmyeong -si와 Gyeonggi -do에서 발행되었을 때, 나는 매시간 발행되었습니다.나는 형사 사기를 체포했다.많은 수표 카드, 대포 계정 및 ID 카드가 필드에 복사됩니다.확인되면 Gwangmyeong -Si와 Gyeonggi -do가 발행하고 2015 년 8 월 14 일에 개장했습니다.이 두통이 열렸는지 모르겠습니다.작년에 문을 열었습니다.나는 경찰이 아닙니다.검찰에 전화하십시오.주요 고발은 다음과 같지 않습니다.계속되면 나중에 클레임을 찾으면 해당 시점에 참석하고 전문적으로해야합니다.전체 프로세스는 녹음으로 진행할 수 있습니다.예, 녹음은 그것이 제출되었다는 증거입니다.대신, 그것은 법원이기 때문에 제 3 자의 소음과 목소리가 혼합되면 새벽에 발생하기가 어렵다는 증거가 있습니다.나는 녹음해야한다.내가 전에 요청한 질문을 기록하십시오."
416,"이제 같은 날에 새로운 편집은 상용화하기가 불가능합니다.감정적 인 방식으로 불가능합니다.따라서 바이 패스를 통해 하루를 올리는 데 도움이됩니다.먼저, 당신은 쉽게 생각할 수 있습니다.어렵다고 말 해주세요.그러나 정상적으로 올라가는 방법을 알고 있다면 우회에서 어떻게 상승하는지 이해할 수 있습니다.이 방법은 현재 금융 회사와 대출의 사례 인 경우 계약 기간이 설정된다는 것입니다.대출이 정해진 경우, 변경되면 계약은 일반적으로 지난 3 년간 연체없이 상환 후에 만료됩니다.언젠가 바이 패스는 드문 일이며, 이것은 가장 확실한 상환 방법입니다.이것은 현재 금융 마찰에있을 때 또는 대출을받은 후 대출이있는 경우 일반적인 사용법입니다. 따라서 금융 회사의 문제를 해결하겠다는 주장이있는 경우 문제를 해결할 수 있습니다.금융 회사가 무시되는 경우가 많지만 은행 협회는 현재 손상되지 않아야하기 때문에 현재이를 받고 있습니다.금융 은행 은행을 관리하는 은행 협회의 불편 함을 주장합니다.당신이 지금 더 불편하다면, 주정부는 이제 제조업체로부터 대출을 받고 있으며 그것을 받았으므로 잘못된 부분이 없습니다.그것이 방법입니다.그 상환을 위해.정부 지원 제품이기 때문에 우리는 우리가하는 일을 조금 할 수 있습니다.현재 고객에게 신청하는 경우이 방법은 가장 빠른 대출을받을 수있는 가장 빠른 금융 회사입니다.나는 그것을 사용하지 않습니다.대출 금액이지만 은행 협회의 컴퓨터 컴퓨터 당일에 업로드하십시오.나는 상환해야했다.지금 허가를 승인하십시오.편집은 제기되지 않았습니다.당신은 그것을 처리해야하고, 오늘 빌려 오늘 상환하지만, 3 년 안에 컴퓨터에서 모든 것을 사용할 수 있습니다.문서를 작성하고 컴퓨터에 등록합니다.오늘 갈거야.측면에서 보증을 발행 할 수 있다면 대출을 처리 할 수 ​​있습니다.복잡합니다."
417,"3 개월 이상 부채를 사용해야하므로 햇빛을 계속할 수 있습니다.빚이 있으며 이제는 문제가 있습니다.고객은 지금 어떻게해야합니까?특히 우리 편으로, 당신이 고객이라면, 당신은 우리 옆에서 직접 이동하여 지금 그것을 전송할 수 있기 때문에 그것을 해결해야합니다.측면으로, 당신은 우리 편에서 자금을 얻을 것입니다.모든 것을 정리하는 것은 어렵지 않습니다.후추의 경우이자 만 지불하면 이제 원칙을 나누는 동일한 방법입니다.그 후, Pepper Savings Bank가 여기 있습니다.이제 5 백만의 승리입니다.나는 단지 일부 부품을 상환하고 싶다.이렇게 말할 수 있습니다.나는 어떻게 고객입니까?지금 당장 그렇게 할 수 없으므로 우리는 우리 편으로 갈 수 있습니다.그리고 이제 관리자에게 전화하십시오."
418,은행 은행을 가질 수 없었습니다.카드가없는 은행 책을 볼 수 있습니다.당신은 그것을 매우 빨리 만들어야합니다.당신은 바로 그것을해야합니다.당신은 캠핑 전화를 받았습니다.왜 Geumgang 산에 가고 싶습니까?걱정하지 마십시오.지금은 당신이 지금 그대로 일하지 않기 때문입니다.걱정하지 마십시오.나중에해야합니다.나는 그것을 모른다.계속하고 시간을내어 미리 전화하십시오.
420,"뭐.정부가 자금을 지원 한 기금입니다.Notar의 1,800 만 반품 및 송금을 입력 할 수 있습니다. 무엇을 입력합니까?2800.예, 놀라운 비용은 502,000 원입니다.502,000 원의 환불이있는 경우 3 개월 또는 3 개월 동안 3 개월 동안 머무르지 않으면 한 번받을 수 없습니다.。"
421,"나는 당신이 당신의 고위 정부 대출로부터 대출을받을 수 있다고 말했지만, 나는 그것이 다르다는 것을 알았습니다.나는이 신용 보증을 사용합니다. 나는 이것을 좋아하지 않으며 정부는 정부에서 그것을 보장합니다.그게 중요합니까?당신이 우리에게 사람들의 수를 말하지 않는다면, 그것은 사실이 아니며, 그것은 평범한 사람들을위한 대출입니다.그것은 모든 회사와 다릅니다.당신은 얼마를 말했습니까?, 당신은 평범한 사람들의 대출로 그것을 할 수 있습니다.당신이 그것을 받으면, 나는 당신을 만날 것입니다.한 달이 있다면 모든 고객에게 지불해야합니다.이것은 24,7716 원입니다.5.4 프로.발급 비용에 대한 예금이 있습니다.새로운 간염 I. 예, 신용 보증을받은 사람인지는 중요하지 않지만 말도 안됩니다.예, 들었습니다. 그래서 할 말이 없습니다.한동안, 한동안, 38,2500 개의 예금은 560 개의 원예 경작이며 보스는 어렵습니다.그것이 그것을받은 후 3 개월이 지난 후에, 그것은 38,2560에 불과했으며, 이는 4 개월에 대출을받은 은행 책에서 380,000 승를 얻었습니다.2560은 자동으로 사라지지 않는 돈입니다."
422,"부국장 인 Honey는 스스로 이동할 필요가 없습니다.당일 은행 계좌 당일 은행 계좌에 연결된 현금 카드가 있습니다.이것을 직접 움직일 필요가 없습니다.'회사 세금을 줄이려고 노력하고 있습니다.당신이 라이센스가있는 경우, 당신은 개인적으로 당신의 개인 이름과 은행 계좌로 나에게 맡깁니다.나는 지금 내 세금을 줄이려고 노력하고있다.그것은 수익성이 높고 나는 지금 한 달에 260 채의 주택을 얻을 것입니다.당신은 그것을 어떻게 받아들입니까?카드 비밀번호를 확인하십시오.계정이나 무언가 또는 와이프 계정으로 촬영하려면 설정 계정으로 촬영하십시오.나는 서울에있다.Gyeonggi -Do Suwon은 매우 좋습니다.그것은.우리 편의 택배 엔지니어.리입니다.당신이 도착했을 때, 그 사람은 잠시 동안 나왔습니다."
423,"안녕하세요, 물어 보겠습니다. 작년에 통보를 받았습니까, 아니면 확인을 받았습니까?신분증을 가져와 은행에 가야하지만 은행 계좌는 없습니다.이를 위해서는 부동산이 필요하므로 130 명 이상의 후보자를 위해 은행 계좌를 구입했습니다.자신을 포함하여 연락하십시오.그들이 고려되고 사용되기 때문입니다.나는 그것을 얼리는 것에 동의합니다."
424,"Kim Seung -e를 알고 있다면 차이가없고, 우리는 기소에서 금융 범죄 -축복 식사를 체포했으며, IBK 은행 계좌가 현장에서 발견 된 후에 조사 중입니다.은행을 개설하든 Kim Seung -Jae의 직접 계정을 제공했는지, 또는 개인 정보가 유출되는 동안 Rohya가 된 피해자가 지금 당장 살았는지 여부.소송 계획을 찾고 있습니다.이것은 우리 시설 팀입니다. 받아 주셔서 감사합니다.권장 사이트에서 잠시 동안 지불했습니다.당신은 우리 편에서 열심히 일합니까?당신이 빛에 돈을 덮고 집에 가면, 당신은 가해자이지만, 나는 당신을 모릅니다.이름 전송이나 이름의 이름에 연락하거나 손상이 있는지 확인했습니다.설문 조사 기간이기 때문에 말하기가 어렵습니다."
425,"안녕하세요, 저는 이민국의 나라입니다.등록 된 등록으로 보내는 등록 된 이메일이 있습니다.다시 물어 보려면 0을 누릅니다.참조하려면 9를 누릅니다.과거에 있지만 조금 정확합니다.지난 4 월 28 일 신청하면 미국 관광지입니다.나는 관광 비자를 신청하지 않았습니다.무엇을 신청 했습니까?최근에 신분증이나 여권을 잃었습니다.결과적으로, 그것은 다른 사람들에 의해 불법적으로 착취 된 것처럼 보이지만 사실이지만, 재산이나 신용이 다른 피해자와 함께 갈 수 있기 때문에 즉시 보고서를받습니다. 증가.""전화 할게요. 전화에 응답하면 신청하지 않겠습니다. 설명 할 수 있습니다."
426,"안녕하세요, 30 명의 후보자로부터 폭력을 구매했다고 말하면서 연락해야 할 부분입니다.당신이 그것에 대해 이야기한다면, 어떤 사람들은 돈을 받고 있습니다.송장의 타이밍에서 3 천만 명이 도움을 청했습니다.나는 검찰로서 그것을 받아 들여야하기 때문에 인생 혐의로 기소되었지만 지금은 일하고 있습니다.개인 정보로 인해 유출됩니다.나는 그것이 이름으로 사용되었음을 확인하기 위해 연락을 받았습니다.귀하는 자신의 상주 등록 카드, 운전 면허증 또는 다른 사람에게 사랑합니다.나는 5 년 동안 해외에있었습니다.나는 지난 달에왔다.약 200 명의 사상자가 있지만 거의 200 명이 관여하지만 조금 어려웠으므로 3 명의 Kanjangjang이 3 명을 만들어 팔았다는 것이 확인되었습니다.당신이 당신이 있었더라도, 당신이 당신의 이름을 훔치기 위해 은행 계좌를 만들면, 이것은 당신을 가장 손상시킬 수 있습니다.가해자와 나는 그것을 이해합니다.이해됩니다.저는 비 지불액 설문 조사 팀입니다.이 나라에는 약 180 명이 있습니다.또한이 나라에 참여하는 부품이 있으며 많은 사람들이 참여하고 있습니다."
427,"관점에서 볼 수 있습니다.그것은 나의 부모 일뿐입니다. 사진에 참여하고 있다면 접시 나 접시가 있습니까?당신이 당신을 만나러 오지 않으면 할 수 있습니다.지금 이걸 먹어, 난 지금 먹지 마.왜이 문서를 호출 했습니까?"
430,"우선, 발견 된 계정은 회사 계정이기 때문에 사용하기 쉽습니다.우리는 은행 계좌를 개설하여 대포 계좌로 판매하지 않습니다.다른 이벤트에 대해 이야기하고 싶다면 세 가지 사례가 있습니다.이 사례는 전국적으로 약 180 명입니다.그것은 범죄자들이 사용하는 희생자들의 혼합입니다.그것을 본 많은 사람들이 있습니다.나는 상담으로 체포되었습니다.내 이름으로 발행 된 Nonghyup 및 Kookmin Bank 계정의 프로세스.내가 당신에게 준 이유는 송장을 되돌아 보는 것이 었습니다."
